restaurant_name,score,reviews
정수제돈까스,,"클래식을 들려주며 만든, 수제소스의 돈까스은행사거리 중심에 자리한 작은 매장나름 업력이 있고, 단골도 많은 편돈까스와 우동, 모밀 중 등심돈까스 주문흑미밥에 샐러드, 우동국물과 단무지, 깍두기돈가스는 두툼한 일본식인데, 클래식을 들어 그런가 ㅎ 살짝 공간감이 있음바삭하고 고소한데 여유있는 식감이랄까 ㅎ무엇보다 이곳의 백미는 소스에 있다짜지도, 시지도, 달지도, 자극적이지도 않게자연스러운 단맛에 어느쪽에도 치우치지 않은 완벽한 밸런스.두툼한 일본식 돈가스에는 소금이 최고의 궁합이라 믿는 편인데, 이곳에는 요 소스가 최강인듯 ㅋ // 일식 돈까스 전문점인데 특이하게 등심 돈까스만 있고 안심 돈까스는 없다.돈까스의 튀김옷이 너무 두껍고 딱딱했다. 기름 맛도 너무 많이 나는 것 같았다. 별로였다ㅠ가격이 8~9천원인데 중계동 학원가에서 포지셔닝이 좀 애매할 것 같다. 조금만 더 가면 상계역에 코코로 돈까스가 있고 노원역엔 마쯔무라 돈까스가 있으니 맛있는 돈까스를 찾는 손님들은 굳이 찾지 않게 될 것 같고, 학생들에겐 가격대가 조금 높을 것 같다."
우리집,,양념이 달지않고..달지 않고..갈비가 달지 않고..네네 전 좀 달달허니~양념간도 쌘걸 좋아하는 편입니다~^^근대도 고기 질도 찔기지 않고 좋네요잉잡내없고~굽기만 잘 구어 주신다면 맛있게드실수 있으실꺼 같아영~불판좀 갈아주세요^^친절 하시군요~갔을때도 사람이 계속 오더군요계란도 촉촉~이건 간이 잘 되어서 나오는군요계장~특이합니다~양념이 디게 맛있군요~그리구~된장찌게는 일반적인듯 하고 비냉은~일반적으로 접해오는 맛과는다소틀린 특색있는 맛이랄까?계장도 그렇고 냉면도여기 양념 따로 연구하시나요?그..시골 엄마의 손맛?그런 느낌입니다 보기엔 그냥 체인점 같은 느낌인데반찬들이 깔끔하고 특색있는 이 양념들~전 반찬 맛있게 만드는 집이 좋더군요^^왕갈비가 맛있다는 추천을 받고 석계 찾아가 봤어요늘 집 주변만  다니다가 정말 오랜만에 외식했네요이집 깔끔합니다~추천
고전한방삼계탕,,"저는 삼계탕을 무지무지 좋아합니다!!시간이 안맞아서라기 보담은 체질이 틀려서?입맛들이 틀려서..전 돼지고기 보다는 닭고기가 좋은데..^^;;여튼 식성들이 틀려 가끔 저혼자 몰래먹습니다~이러지 않음  저는 먹을 기회가 없습니다  ㅜㅜ돈까스 피자같은 패스푸드 무쟈게 좋아하는 사람들..전 그냥 탕.국.죽.찌개  이런걸 좋아하는 스타일 이라서가끔 너무 힘들때가 있습니다^^;;너무 안맞아 증말..ㅋ여튼 간만에 먹으니 역시 맛있습니다속이 편해요 부담없고 든든하고!!몸보신 한거 같아영~상차림에 닭~모래집에 인삼주가 나오니기다리는동안 드세용 이게또 이집의 기똥찬 서비스 아니겠습니까?삼계탕 나오는데 시간이 걸리니기다릴때 심심... 멍때리지 말고 드시면서 위를 달래주는 ~이런 바람직한 서비스칭찬해요 인삼주는 인삼향이 나면서 알싸한~술못드시는분은 드시지마세요 은근 쌤 !!!모래집도 잡내없고 간편하게 드시기 좋아요!메인 기대하시라~개봉박두!!이거징~ㅎㅎ삼계탕이 나오공~국물도 약간 미음같은 느낌 ~닭이 뜨거버요 전 닭 꺼내서 발라먹기전에 배를 갈라 찹쌀을 뚝배기로 옮긴뒤~닭을 알뜰살뜰 빠르게발라먹습니다 왜냐 뜨거브면 많이 못묵어 ~식혀 묵어야징 ㅎㅎ뼈가 입안에서 뾱~뾱~분리되어 발라먹기 좋고~뚝배기에 찹쌀닭죽을 후후 부르며~한입아뜨뜨거버~혀를 데었어영 ㅋ이게또 이런맛으로~속이 편하고 든든하고너무좋아영~안에들은 한약재우엉? 땡!!ㅋ 감초?구기자.당귀.밤.~이런게 들어간 춘향식!!이곳은 도령식 춘향식이 따로 있죠^^가시면 알아서 여자분은 춘향 남자분은 도령~으로 약재가 달리들어간 삼계탕을 주십니당^^저도 가게할땐 여기 왕왕 단골이였는데~여튼 오랜만에 와도 여전히 맛있는 이집 추천해용~^^사육기간 50~57일 가평웅추삼계사용하고 있답니다잡내없고 발라먹기좋고 찹쌀풀어 죽처럼~먹고속 편하고 든든한거~같아요♡간만에 또 행복해 집니다 ㅎㅎㅎ가족과 건강하고 행복하시길 바랍니다~#항상함께해 // 진짜맛있는 삼계탕집!!밑반찬으로 닭똥집과 인삼주를 주는데, 닭똥집이 비리지도않고 정말맛있어요! 김치도 깍두기도 맛있고, 뽀얀 국물이아니라 걸죽해서 죽같은 국물인데 정말 깔끔하고 먹으면 건강해지는느낌!!!남자는 도령,여자는 춘향으로 주시는데, 효능이다다르대요~  살코기도 야들야들하고 안에 찹쌀까지 국물이랑 후루룩먹으면 든든!! :)"
이자와,,"0. 누군가에겐 추억이라는데 처음 들어보는 브랜드였고요. 2. 규카츠집에서 돈까스를 먹은 죄? 그냥 일반 메뉴나 먹지 감히 한정메뉴를 시킨 죄? 무엇이 문제였던걸까. 등심 + 지방으로 만들었다는 매뉴를 시켰는데 지방이.. 맛이 없어요. 잡내도 나는거 같고. 튀겨서 나온게 맞나 싶게 걍 따듯하고. 체감상 상당히 오래걸렸는데 식혀서 나오느라 그랬나. 3. 직원분들 생기가 없습니다. 힘빠지는 대응. 인스타 올리면 음료 하나 주는 이벤트 중인데 그걸 굳이 미리 말해야 하는 이유도 모르겠고요. 추천하지 않아요. // 노원역 일식집 중 가장 속이 편함가성비 좋음 // 고기러버라 항상 삼겹살, 돼지갈비, 족발보쌈, 돈까스 등만 먹어보고 규카츠는 처음 먹어봤는데 여기가 특별히 맛있다는 느낌은 아니었다.양도 너무 적고 규카츠는 원래 이런건가 싶었다. 규카츠정식을 다 먹어도 포만감이 들지 않는 정도. 무엇보다도 미디엄~미디엄레어답게 속에는 은근히 빨갛게 물든 모습을 보고 싶었는데 거의 다 익어있어서 사진찍을 가치를 못 느꼈다. 겉에는 나름 바삭. 미니화로 있어서 구워도 먹어보고 소스맛으로도 먹어봄 // 노원에 있는 이자와를 방문했어요브레이크 타임 5시딱 지나서 들어갔습니다건물2층에 있는데 생각보다는 환기가 잘 안되는것 같더라고요... 대표메뉴인 규카츠를 주문했는데 부드러운 고기는 맛있지만... 양은 부족한듯한 느낌ㅠㅠ굳이 찾아갈정도는 아니고 노원에 갔는데 딱히 먹을만한게 없네! 할때 가볼만한것 같아요 // 원래 규카츠 안좋아는데 워낙 별로라는 얘기를 많이들어서 그런가 생각보다 맛있었다.모토무라에서 먹은거보다 엄청 다른맛도 아니고 기본은 비슷한데 느끼한 정도만 좀 차이나는정도"
이종구낙지세상,,"매콤한 낙지볶음에 고소한 낙지해물파전재개발이 예정된 104마을 근처,사람들이 줄줄이 블어가는 이동네에서는 꽤 유명한 곳낙지를 테마로 해서 낙지볶음, 전, 연포탕, 낙지찜, 낙지갈비전골까지 다양함낙지볶음에 해물낙지파전 주문나물 두종류에 백김치, 샐러드, 된장찌개가 나오고매장한켠에 마련된 셀프바에는 연두부도 먹을 수 있음해물낙지파전은 튀기듯 부쳐낸 두툼한 스타일바삭한 첫맛에 쫄깃한 낙지와 아삭한 야채가 어울려계속 먹게 만듬매콤달콤한 양념에 은은한 불향, 통통한 낙지들어간 낙지볶음은 맛있게 맵다밥과 낙지볶음, 각종 나물 넣어 비빔밥 만들고담백하게 끓인 시골된장 한술이면 마무리까지 훌륭하다왜 인기가 많은지 알 수 있는 곳 // 낙지볶음 맛집이라기에 찾아갔다.알고보니 ""이종구 낙지세상""이 5군데나 있고,여기가 본점이었다.일단 들기름 솔솔~~나물반찬이 맛있다.백김치도 달거나 짜지 않고,깊은 맛이어서 좋았다.낙지볶음 2인분과 낙지 해물전을 주문했는데~회전율이 빨라서인지 낙지가 신선했다.콩나물을 넣고 비빈 낙지볶음의 간도 딱맞았고~해물전도 맛있게 먹었다.주차는 가게 앞에 할 수 있다.동생은 많이 올랐다고 하는데~아직도 가격이 착하고...근처에 오면 또 들려야겠다."
신전떡볶이,,"저는 개인적으로 떡볶이를 그렇게 좋아하진 않는데 가끔 생각나면 먹어요신전떡볶이도 유행다지난뒤 먹어보는 1인ㅋㅋ워낙 유명한 치즈떡볶이매운맛 쫄보라 순한맛으로 먹었는데도 살짝 매콤했어요치즈가 순화시켜주고 자꾸 손이가는 맛이더라구용치즈가 금방 굳는건 살짝 아쉬웠음참치마요 컵밥, 오뎅튀김도 맛있었고 가끔 생각날것 같아요 // 무난한거같다가도 종종먹는거보면 나쁘지않음 // 이삭토스트만큼이나 추억이 가득한 곳....정말 정말 오랜만에 방문했는데 전보다 맛이 없어진 느낌이다.그냥 나혼자 추억에 젖어서 아 옛날 그 맛이 아니야!를 외치는 건진 모르겠지만 전보다 카레향과 매운맛이 약하게 느껴졌고 맛에 이렇다 할 특징이 없었다.여기보다 나은 선택지가 많아져서 그런가.. 이제 굳이 신전을 찾을 이유는 없을듯. // (먹던 사진이지만) 치즈김밥이 아주 꿀맛이당! 안에 뭐 든것도 없어보이눈데 신기하게 맛있음! 어묵튀김두 유명한만큼 맛난당ㅎㅎ 노원점은 가게가 좁아서 약간 복닥복닥 거리는 느낌이..ㅠㅠ 직원들도 그렇게 친절한 편은 아닌.. 걍 시켜묵겟음 // 떡볶이에 어묵없이 떡만 있어서 좋았고치즈도맛나고ㅜㅜ다른지점에서시켰던컵밥에비해서양도적고맛도실망......"
기차가있는풍경,,"화랑대옆 철도공원 안에 위치한 카페에요. 음료나 디저트가 맛있다기보단 아이들 데리고 가기에 최적화된 곳이에요. 음료를 장난감 기차가 기찻길을 따라 서빙해주고, 정해진 시간마다 실제 우주선이 발사되는 것처럼 장난감이 자동으로 움직여요. 어른이 봐도 멋있더라구요.  루프탑은 편하게 쉴 수 있는 데이베드가 있어서 아이들이 놀기 좋더라구요. 날씨 좋을 때 꼭 루프탑까지 즐겨보세요. // 훌륭한 에스프레소와 하늘과 철길이 내려다보이는 루프탑 뷰춘천가는 기차가 전철로 바뀌면서열차가 다니던 철도는 덩그러니 남아 풀과 나무와 함께 경춘선숲길이 되었다가끔 그 길을 걷고는 하는데 공릉동에서 멈추지 않고한블럭 더 가면 육사 옆 화랑대철도공원을 만난다꽤 넓은 부지에 조경과 조명이 잘 관리되어 있고열차와 카페와 미술관도 있어서주말이면 사람이 북적북적한다특히 기차가 배달하고 우주선이 날아오르는기차 카페 1층에는 아이들 손님이 복작복작한데, 2층은 에스프레소바로 꾸며져서 조용한 분위기, 다양한 원두의 드립커피를 만날 수 있다머신도, 원두도, 바리스타의 솜씨도 좋아서커피맛도 좋음 ㅎ이 커피를 받아들고 한층 더 올라서면파란 하늘과 초록빛 숲과 철길이 내려다보이는 루프탑이 나타난다조용한 평일은 물론이고 시끌시끌한 주말에도 휴식을 주는 공간저녁에는 불빛정원이 되니 그 또한 운치있음전망과 맛까지 모두 갖춘 노원에서 유일한 곳이다 // 화랑대 철도공원 안에 있는 카페예요. 기차가 전달을 해줘서 신기하고 아이들이 좋아해요. 다만 제조음료는 5시~6시사이 브레이크타임이라고 안된다고 하네요."
대가가마솥순대국,,굿 // 일반 순대국만 주문해도 솥밥이 딸려나오는 곳.맛은 깔끔하고 무난하게 맛있는 거 같으면서도 은근히 땡기는 편. 국물까지 다 먹은걸 보면 맛있었던것 같다 다 먹은 후인 숭늉까지 먹을 수 있어서 아주 든든한 한끼가 가능하다. // 순대국을 시키면 솥밥을 주는 국밥집이 있다?! 꼿꼿이 기립하고 있는 흰쌀밥과 담백하게 고아 낸 사골국의 조화. 국물이 살짝 밍밍한 편인데도 쌀알에 엉겨 붙은 쫀쫀한 맛은 백미다. 심지어 주문한 메뉴가 순대 정식인데도 불구. 뚝배기 안 건더기가 푸짐. 게다가 잡내없이 깨끗하게 씹힌다.달짝지근한 김치과 새콤한 깍두기는 부족한 간을 채운다. 맛보기 순대나 수육과 곁들어 먹기에도 아주 탁월하게 담았다. 마지막으로 미리 뜨신 물 부어 둔 숭늉으로 매조 지으면. 국밥 첨 먹는 외국인 아저씨도 이건 못 참지.
한스친친,,"23-86짬뽕을 좋아하지만 맵찔이라 너무 매운 짬뽕은 힘든 저에게 이곳 짬뽕은 정말 맛있는 짬뽕입니다매운맛을 좋아하시면 맵게 시키거나 다른 매운짬뽕을 시키셔도 좋습니다자장면도 맛있습니다평일 오후에 만석으로 꽉찬 중국음식점을 정말 오랜만에 봤습니다손님들이 많습니다탕수육도 맛있습니다살가운 친절도 좋았습니다오랜만에 기본이 맛있는 중국 음식점에서 맛있게 한끼를 먹었습니다방문추천 90%친절도 상청결 중주차불가 // [ 광운대 역 앞 2층에 위치한 중국집, 한스친친 ]• 찹쌀탕수육(소) 16,000원전체적으로 요리 맛집이라, 메뉴판 요리류에 있는 부분은 다 맛있다는 소문이 들었다. 탕수육 소스 같은 경우는 강하지 않고 적당한 수준의 자극적인 맛이었고, 탕수육 고기는 튀김옷이 두껍지가 않아서 적당했고 튀김옷이 조화로웠다.•소고기 짬뽕 10,000원이 곳 짬뽕은 전체적으로 다 깔끔하다. 어떤 육수를 쓰는지 모르지만, 육수가 다 맛있다. 소고기 짬뽕은 고기 특유의 진한맛이 잘 느꼈졌고, 맵기도 적당해서 위 부담없이 해장 하기 좋다.•삼선짬뽕 9,000원 (매운맛 중으로 선택)해산물과 고기 국물은 확실히 다르다. 두개 짬뽕맛이 구분된다는 점이 이곳의 매력적인 포인트다. 삼선찜뽕운 시원하다는 맛을 부여할 수 있는 국물맛이다. 해산물이 꽤나 많이 들어서 재료를 골라 먹을 수 있었다. 또 먹고싶다.광운대 주변 중국집 중 가장 맛있는 곳이라고 자부할 수 있다."
메밀마당,,"따스한 옷을 입은 햇빛이 뜨거운 옷으로 갈아입을 채비를 한다. 잠시 쉬고 있던 시간도 슬슬 기지개를 켠다. 잊고 있던 여름을 반길 준빌 하나 둘하고 있다. 나도 시원한 국물 음식으로. 저 앞에서 똑똑 문을 두드리려 하는 여름을 기다린다.상계동에 근무하는 직장인들을 위한 작은 음식점. 소박한 공간과 착한 가격. 어떻게 리뷰를 써야겠다는 딱딱한 잣대는 내려놓은 채 냉기 가득한 음식을 기다린다. 곱빼기로 골라도 부담스럽지 않은 막국수와 꿩만두 반 접시를. 만두는 동그랗게 구멍이 난 모습을 보곤. 흔한 기계 만두 일 거라 지레짐작했지만. 직접 빚는 만두라 일러주니 그냥 넘어갈 수 없었다.단단히 동여맨 막국수 타래를 풀고 다대기와 진하게 스며들게끔 힘차게 젓가락을 움직인다. 유명 막국수집들처럼 대단한 배합으로 만든 메밀면은 아니지만. 조용한 멋을 가진 메밀면은 축축이 목을 적신다. 까끌거리거나 툭툭거리는 요란스런 매력은 없어도. 고즈넉이 앉아 선선한 바람을 기다리는 나그네처럼. 금세 흘린 땀도 훨훨 날아갈 만큼 시원 달콤하다.적당한 온기를 품은 꿩만두. 축축했던 막국수 위 초록빛 잔디가 자라난 듯 부드럽고 담백하게 지나간다. 막국수만큼이나 훌러덩하고 또 사라졌다. 막만두라는 새로운 이름을 지어도 되겠다. 정성과 진심으로 빚어낸 음식들의 연속. 짙은 여운이 여름과 헤어지는 날까지 머물다 가려 한다. 우이동 춘천막국수전문과 함께 문지방 닳도록 드나들겠다. // 노원역 상계주공3단지 주변 상가 1층에 있는 막국수집. 갑작스런 더위로 입맛이 사라져 방문한 곳이다. 물막과 비막 주문. 밥솥으로 만든 듯한 구운 계란이 오이, 쌈무 고명과 함께 올라간 것이 눈에 띄었음. 담음새 좋고. 먼저 맛본 육수는 조미료 맛이 없이 약간의 산미와 함께 엄청 자극적이진 않으면서도 새콤하게 즐길만 했음. 비빔장도 자극적이지 않고 텁텁함 없이 깔끔해서 굳이 겨자, 식초 안넣어도 되는 밸런스. 면은 특별한 건 아니었지만 잘 삶겨져 적당한 탄성이 좋았다. 함께 나온 열무김치도 단맛없이 시원하고 막국수에 곁들여 맛나게 먹음. 특출난 맛집은 아니지만, 밸런스가 좋고 밥맛 없을 때 와서 먹으면 한그릇 뚝딱 가능. 점심 때는 웨이팅 있음."
만취,,프라이드족발 개존맛!! 겉은 바삭하면서 부드러운 속살...짬뽕탕도 얼큰하니 술을 부르는 맛이다... 하이볼두잔순삭..협소하지만 가볍게 친구들과 술마시기엔 넘 괜찮은 술집!(사진이 좀 맛없게 나왔는데 맛있었음) // 칠리깐풍&새우 18500원동네에 새로 생긴 술집이라 궁금해서 가봤는데 생각보다 맛있어서 놀랐어요‼️공트럴파크쪽에서 한 5분만 걸으면 나오는 집인데 철길 산책하시다가 가볍게 한 잔 하고 싶을 때 가볍게 가기 좋은? 과기대 앞 술집들은 너무 시끄러워서 별로였는데 오랜만에 괜찮은 이자카야 찾은 것 같아요 깐풍새우에 나오는 새우크기도 크고 튀김옷이 바삭해서 맛있었어요‼️오징어 다리튀김 15000원대학생이라 비싸기만 하고 양은 적으면 어떡하지 하고 걱정했는데 오히려 일반적인 이자카야에 가면 나오는 튀김양보다는 확실히 더 많은 것 같아요‼️같이 나오는 소스에 찍어먹으면 더 맛있더라구요 맥주 한 잔이 정말 잘 어울리는 안주였어요 총정리:새로 생긴 술집이라 그런지 서비스도 친절했고 음식 맛도 맛있었어요 공릉에 있는 새롭고 안주가 맛있는 술집 찾으신다면 한번쯤 가보시는것도 좋을 것 같아요
밀스,,창동사는 친구들의 강력추천 빵맛집 「밀스」 방문했어요 :) 동네맛집이라 자주 방문한다고 해서 믿고 초코케이크를 주문했는데 진짜 사르르 녹으면서 너무 달지 않은 맛이라 끊임없이 흡입하게 되었어요!! :) 케이크 디자인만 봤을땐 뭔가 옛날케이크 느낌이었는데 맛은 좋은 재료를 아낌없이 쓰신게 너무 느껴지는 맛이어서 먹는내내 기분이 좋았습니다 :) 다음에 들릴수 있다면 빵을 이것저것 구매해서 다 먹어보고 싶어요 :) // 케잌도 빵도 아주 맛있어요 // 여기는 무조건 식빵입니다. 기본 식빵도 맛있지만 치즈덕후인 저는 치즈식빵을 강추합니다. 촉촉하고 고소하고 짭쪼름한 치즈까지.... 아무것도 안바른 식빵 한봉지를 순삭할 수 있어요.다른 빵들은 그냥 평범한 인상입니다. 어쩌면 식빵이 너무 강렬해서 그럴지도요. 매장 가봐도 식빵이 메인이라는걸 바로 알수있습니다. 여러분 제발 밀스 식빵을 드세요. 저의 식빵인생의 2막을 열었습니다. 이 리뷰를 쓰면서도 밀스 식빵을 생각하니 배가 고파집니다. // 앙버터와 에그마요빵. 둘 다 별로였다.앙버터의 바게트가 매력없이 질기기만 했고 앙금이 지나치게 달았다.에그마요빵은 빵과 속이 전혀 어우러지지 못하고 따로 논다.마요네즈도 시판 마요네즈의 그 맛이 너무 적나라하게 느껴져서 실망. // 여기서 맛없는 빵 먹어본 적이 없음
우리집식당,,"독특한 풍미의 들깨소양탕과 갓김치의 조합점심 무렵에 월계동으로 양탕을 먹으러 가자길래, 네비로도 검색이 쉽지 않은 곳을 아무생각없이 따라나섰는데, 도착하고 보니 콜린님이 극찬 한 그곳이더라 ㅎ 메뉴는 양탕과 양무침 딱 두개고, 맛깔나는 반찬과 와사비장, 다대기, 소금, 고추절임 세팅사장님이 먹는 방법을 알려주신다처음 반공기는 반찬이랑 양을 찍어 먹으며 따로국밥처럼 먹고, 다음은 밥을 말아서, 갓김치로 간을 맞추어 먹어보라 하심 ㅎ한입만 먹어도 신선함과 손맛이 느껴지는 반찬,양탕 한술에 묵직한 구수함이 가득하다손질 잘한 양은 잡내 하나 없이 쫄깃쫄깃백미는 역시 갓김치였는데, 개성 강한 양과 들깨, 갓김치라는 재료들을 합쳐놓으니풍미도 오묘하고, 서로의 단점을 감추는 것 같기도 하다분명 처음먹어보는 맛인데, 모험심이 들기도 하고암튼 다 먹고나면 보양이 될 것 같은 느낌 ㅋ왠지 몸이 허하고 으스스한 날, 뭔가 새로운 맛이 생각나는 날에 추천 ㅎ // 세상 어디에도 없는 돌산갓김치 들깨양탕.—식도락을 하다보면 때때로 “다 거기서 거기” 라는 권태로운 생각에 빠지게 된다. 이럴 땐 전에 경험해보지 못한 음식을 찾아나서곤 하는데, 이 날의 선택은 제3세계 음식이 아닌 노원구 <우리집식당>에서 파는 ‘들깨양탕’이었다.여기서 말하는 양은 동물 羊이 아닌 소의 첫번째 위를 뜻하는데, 양을 넣고 끓인 탕은 설렁탕집, 곱창집 등에서 보통 양곰탕이나 내장탕 등의 이름으로 판매된다.이곳의 양탕은 이름 말고도 두 가지 지점에서 특별함을 가지는데, 하나는 국물에 들깨가 들어가는 것이고 다른 하나는 갓김치를 국물에 말아먹는 것이다.뽀얗게 우려낸 육수에 적당히 넣은 들깨는 국물의 고소함을 끌어올리고 대신 약간의 느끼함을 동반하는데, 이 때 등판하는 것이 돌산갓김치. 따로 먹기엔 다소 짜게 느껴지는 이 갓김치는 밥과 함께 국물에 말았을 때 비로소 그 진가가 드러난다. 소 양과 표고버섯의 탱글한 식감에 대비되는 우적우적 씹히는 식감을 더함과 동시에 시큼하고 쌉쌀한 맛으로 자칫 평범하게 느껴질 수 있었던 음식을 완전히 새로운 것으로 탈바꿈시킨다.아마 내가 서울에서 가본 식당 중에 접근성 떨어지기론 몇 손가락 안에 드는 곳일텐데, 멀리서 찾아가볼만한 가치가 있다는 생각.-주의: 점심 때는 2인 이상만 식사 가능instagram: colin_beak // 지인추천으로 양탕집을 처음 가봤는데, 진짜 너무너무 맛있다!여기는 반찬이 다 맛있고, 양탕이 나오면 취향따라 곁드려 먹을 반찬이나 양념장이 다양해서 너무 좋았다.사장님도 친절하시고, 장사가 잘됐으면 하는 나만의 맛집!식당이 애매한 위치에 있는게 너무 아쉽다.  다른분들도 많이많이 방문해서 더 잘됐으면 좋겠다. 참고 리뷰: https://m.blog.naver.com/dltksla20/221996619909"
그루브커피로스터스,,"공릉동에서 가장 추천하는 카페를 말하자면 여기를 꼽을거같아요. 분위기는 물론 커피도 맛있고 디저트가 진짜진짜 맛있어요 // 콜롬비아 포토시 트레스 드라곤에스 내추럴, 카페라떼, 오렌지콩피치즈케이크, 버터스콘 주문가격 저렴, 커피 디저트 맛있음 // 맛과 질      : 35/40  가격/가성비: 16/20 위생/서비스: 17/20위치/분위기: 6/10개성          : 6/10총점       80/100재방문 : 고민주문메뉴 : 필터커피 두잔~(에티오피아, 엘살바도르) // 드립백 6P7호선 공릉역 인근 골목길에 위치해서 동네주민에겐 참 좋은 카페일거 같아요~  외부인들이 오기엔 접근성이 많이 떨어지는게 아쉽네요.아늑하고 따뜻한 느낌의 매장분위기였고, 로스터스 카페여서 한쪽편에 로스팅기가 있어요.훈훈한 외국 남자분께서 주문도 받으시고, 커피도 직접 내려주셨는데... 신선한 원두를 잘 로스팅하고 커피 내리는 분의 스킬까지 더해지니 각 나라별 커피의 향이나 맛을 느끼기에 충분했고, 양도 넉넉했으며~가격대도 적당해서 좋았어요.드립백도 6P에 7,500원?~8,000? 정도였는데... 집에서 편하게 내려마시니 굿~!!디저트도 구움과자 몇가지 판매중인듯한데...다른곳에서 많이 먹어서 다음기회에 경험해봐야겠어요.로스터스카페답게 커피의 맛은 만족스러워서 이 근처 온다면 갈듯하지만~ 여전히 접근성이 좀 아쉽긴하네요."
봉추찜닭,,
라무야끼,,"양갈비 무한 리필- 2시간 이용 가능.친구들은 양고기 특유의 냄새가 많이 난다는데 본인은 그닥 느끼지 못함... 무한 리필이다보니 주류 혹은 음료 주문이 필수인데, 그렇다해도 가성비 좋고 맛도 좋다. 처음부터 끝까지 고기 질도 똑같고, 응대도 빠르고 친절함. 카운터 바 자리로만 이루어져 있는데, 2명이 방문하는 게 제일 좋은 듯. 3명이 방문하면 한 명은 고기 굽느라 바쁨 ㅎ,,"
