restaurant_name,score,reviews
소우주,,"노원역 근처에 위치한 아기자기한 이자카야예요. 규모가 엄청 작은건 아니지만 소품 같은게 간간이 있어서 그 특유의 귀여운이 있더라구요. 무엇보다 좋은건 좌식 공간이 있다는거! 테이블 자리로 안내 받았었는데 좌식 공간에 앉을 수 있냐고 여쭤봐서 거기 앉았어요. 다른 좌식 공간은 다 가림막이 있는데 저희 쪽은 없었지만ㅋㅋ 치킨 가라아게 하나 해서 먹었는데 맛은 평범하 닭 튀김이었습니다. 유난히 맛있다고 해서 찾아온 곳이라 그런지 기대에는 못미치더라구요. // 노원역 좌식 자리가있는 술집!이곳은 노원역에 비교적 최근에 생긴 (글쓰는시점 2022.02) 이자카야입니다! 간이 칸막이가 있는 좌식 자리 4개 정도가 있어서 약간의 거리두기가 가능한 술집인 것 같아 리뷰 작성합니다!!메뉴는 특별한 것은 없지만 모듬 사시미, 참치 타다끼, 소고기 타다끼, 바지락술찜, 튀김, 탕 등 엄청 다양합니다. 맛만 보면 그럭저럭 만족스러운 정도인데 가격까지 생각하면 좋다고 느꼈습니다! 먹어본 메뉴 중에서는 참치 타다끼와 나가사끼 짬뽕탕이 좋았습니다!! 이 두 메뉴를 기본으로 가시면,, 만족하시지 않을까 싶습니다! 그 외에 제가 먹어본 소고기 타다끼는 거의 육사시미에 가까운 느낌이었습니다. 캐주얼하고 넓은 동네 술집이기 때문이 친구들이랑 술 마시고 싶을 때 가면 정말 좋을 것 같습니다~~"
청담미역,,노원역 사거리 근처에 있는 미역국집. 오전 일찍 볼일 본 후 출출해서 문 열린 식당으로 방문했다. 가자미 미역국 시켰는데 가자미가 그래도 실하게 들어있어 좋았음. 미역 양도 꽤 많은 편이고. 간이 센게 참 아쉬웠다. 개인적인 미역국 취향이 간 슴슴하게 해서 미역하고 건더기 밥처럼 먹는건데 간이 세니 국을 많이 못먹었다.. 식당인거 감안하기도 해야하고 미역국이니 보통은 가지만.. 9시부터 운영하는 곳이라 아침에 근처에 밥먹을 곳 없으면 와도 괜찮을지도
수시로스시,,"배달팁 제로.. 노원 수시로스시!여기는 초밥을 배달 시켜 먹고싶을 때 항상 찾는 곳 입니다~ 직접 방문해서 먹어봤을 때 맛있게 먹은 기억이 있어서 배달도 시켜봤는데ㅜ 정말 맛있더라구요..! 포장도 랩으로 꼼꼼히 해주셔서 흐트러지지 않고 잘 옵니다! 짱 추천!! // 스페셜 초밥 (12피스 20,000원)연어 초밥 (10피스 13,000원)도미 초밥 단품 (2피스 3,800원)초밥이 너무 먹고 싶어서 급하게 찾아간 수시로 스시..!노원역쪽에서 주택가쪽으로 산책하다보면 어느 빌딩하나 꼭대기에 '초밥' 두글자 써있길래 참 궁금했는데 거기가 여기일 줄이야ㅋㅇㅋ노원쪽에서 초밥을 먹은건 첨인데다가 한테이블 밖에 없어서 무스벘지만 곧 노원 최애 초밥집으로 등극합니닿ㅎㅎ기본찬으로는 콘치즈, 샐러드, 미니 우동이나오고, 우동은 식사메뉴가 아니라 초밥을 시켜야지만 나오는듯...?너무 추웠어서 우동도 시킬까 고민했었는데 서비스로 나와서 넘 다행이었습니당ㅎㅎ 대신 맛이 엄청 좋진않구 면도 미리 삶아두신 듯 해요...!스페셜 초밥은 딱 나왔을 때 메뉴판 구성이랑도 다르고(네기도로 대신 광어지느러미가 한피스 추가됐습니다!), 장어가 사진과 다른 시제품 장어라.. 속았다..! 했습니다..ㅜㅜ새우나 우측아래 흰살생선도 스페셜이란 구성에 안맞지 않나 했구요..!헌데 나머지 8피스가 진짜 맛있어서 다 상쇄되는 느낌??나머지가 딱 이게 니네가 원하는 고오급 생선의 기름짐이지 싶은 기름기 낭낭한 초밥들이라, 어우 좀 느끼한데 싶으면서도 계속 손이 가드라고요..!! 근데 진짜 느끼해서, 간장이랑 와사비를 아무리 올려도 짜지도 않고 맵지두 않습니덩ㅋㅋㅋㅋㅋㅋㅋㅋ그리고 스페셜 세트에 도미가 너무 맛있어서 추가주문을 했는데, 네타 두께랑 상태부터가 다른 걸 보고, 스페셜은 스페셜이군 싶었습니다ㅎㅎ연어도 단품주문은 등살, 스페셜은 뱃살로, 가능한 느끼느끼한 초밥군으로 구성하려 하셨다는게 느껴지더라구용ㅎㅎㅎㅎ연어초밥은 깔끔하고, 회 두툼하고, 연어 냄시도 나고 좋았습니다!원래는 양파와 소스가 기본으로 올라가는 걸로 아는데, 전 싫어서 미리 따로 담아달라 요청했네요~!전체적으로 회두툼하고 질도 괜찮고, 양 많고 좋았습니다!무엇보다도 밥상태가 굉장히 양호했는데, 상당히 부드럽게 쥐어져 아래에서 떠올리듯 들어야합니다! 아예 매장에 젓가락질 법이 쓰여있을 정도에요!회 커보이려고 밥을 무식하게 줄인 것도 아니고, 밥양도 회도 전부 큼직한 느낌입니다ㅎㅎㅎ밥먹는 와중에도 포장/배달/혼밥 손님이 끊임없던 걸 보니 로---컬----맛---집이지 않을까.. 생각합니다ㅋㅇㅋ그 중에서도 혼밥손님 두분이 전부 회덮밥을 드시고 계셔서..회덮밥은 꼭한번 먹어보고 싶네용ㅎㅎㅎㅎㅎㅎㅎㅎㅎ(단품사진이 다 흔들린 건 마음이 급했기 때문입니당...!)"
우애돈카츠,,이골목상권에 이런프리미엄 돈까스집이..여러프리미엄 돈까스보다 가격 서비스 맛 훨씬괜찮다 추천!
케어프리,,"길을 걷는데 초겨울 날씨로 변하고 있어 따뜻한 커피 한 잔이 마시고 싶었다.마침 전에 커피를 맛있게 마셨던 케어프리가 생각나서 방문하게 되었다. 시그니쳐와 같은 초록문이 보여 멀리서도 한 눈에 알아보기 편했다. 안에 들어서니 벌써부터 커피 마실 생각에 신이났다 ㅋㅋㅋ. 라떼를 주문하고 자리에 앉아서 기다리니 커피를 갖다 주셨다. 내가 좋아하는 라떼의 맛을 정확히 찝어주신 커피였따 ㅋㅋㅋ 고솝한 라떼는 늘 맛있는 것 같다.변한게 무엇이 있나 하고 보니 케어프리 굿즈가 생겼다! 초록문 시그니쳐에 따와 초록색 연필,커피드립,엽서들이 있어 연필을 구매하고 왔다. 곧 있음 맛있는 겨울 디저트 나온다고 하니 또 방문해달라고 하셨다. 겨울 디저트 나오면 재방문 할 예정이다 // '수락산라떼 고소한 것이 맛나구나'길을 걷는데 갑자기 비가 내려 급하게 방문하게 되었다.내부는 굉장히 깔끔하고 메뉴들도 참신한 것이 많았다.그중에 시그니쳐 메뉴인 수락산라떼가 있어 바로 주문했다.고소한 아몬드 맛이 입안에 퍼지니 순식간에 후루룩 마시게 되었다. 누구나 호불호 없이 마실 수 있어 어른들도 좋아하실 맛이다.디저트도 꽤나 신선했다. 이 근처 카페에서 판매 안하는 크루와플이나 모나카 제품은 맛이 궁금했으나 솔드아웃 되어서 먹지 못했다. 넘나 아쉬운 것...ㅜㅜ수락산역에서 조용하게 커피 한 잔 마시고 싶으면 방문하실 것을 추천."
슈엔차이,,"""코스로 나오는 중식집""슈엔차이, 중계역 부근에 위치하고 있고 2층에 자리잡고 있다.한 끼 정식 세트로 주문하면 부족함 없이 먹을 수 있는 정식 중식집이다.에피타이저와 디저트까지 빠지는 것 없이 알차게 구성되어 있다.기본 메뉴인 짜장면, 짬뽕, 탕수육 등도 맛있고 훌륭하다.마늘볶음밥도 이색적이고 괜찮았다:)"
더숲,,"노원역 앞에서 지나다니면서 맨날 봤지만 뭐하는덴진 몰랐는데 이번에 가봤다 근데 생각보다 넓고 쾌적하고 잘되어있어서 놀람! 베이커리와 식사, 커피에 와인까지 다양하게 취급하고 있던데 우린 식사 후 방문이라 가볍게 음료만 주문했다 아메리카노와 핫초코로!아메리카노는 그야말로 무난했고, 핫초코가 진짜! 진해서 좋았다 핫초코는 대부분 거기서거기지 느낌이 강한데 여긴 진짜 진한 편이라 굿굿 맘에 들었다공간도 정말 맘에 들었는데 사진은 전시공간만 찍었지만 지하1,2층에 넓직한 테이블이 많이 자리해있고, 분리된 느낌을 주는 룸 형태의 공간, 4인이상이면 이용가능한 세미나룸도 있어 활용도가 좋아보였다 벽면엔 책들이 전시되어있어 구매가 가능했고, 또다른 분리된 공간엔 씨네마도 있어 영화감상도 가능하다 공부하기에도, 문화생활하기에도, 그냥 담소를 나누기에도 다 적합한 정말 복합문화공간!우린 노트북으로 영화를 보고 왔는데 룸 형태의 좌석에서 보니 편하고 좋았다 굿굿 큰 기대없이 구경이나 함 해볼까? 하고 들어간 곳이었는데 생각보다 너무 좋은 경험이라 추천하고싶은 곳이다 다음엔 빵을 좀 먹어보고싶음! 저녁에 가면 8신가 9신가 이후에 30%?할인판매를 하던데 그걸 노려도 괜찮을 듯 하다 추천!.아메리카노 Hot (₩4,500)발로나 초코 라떼 Hot (₩5,800).맛 ★★★★가성비 ★★★총점 ★★★☆"
미미,,서울에서 맛보기 쉽지않은 중화비빔면이있어서 먹어보니 정말 맛있었다. 간이 조금 강하다는 느낌이 들지만 그래서 오히려 좋았다. 또한 간짜장은 정말 이 주변 중국집 중 최고라 생각한다. 불맛이 들어가 정말 맛있다. 탕수육과 사천탕수육은 그냥 특별한것 없는 맛있는 탕수육이였다. // 생긴지 얼마 안된 중국집인데 서울에선 잘 안보이는 메뉴인 중화비빔밥을 판다. 진한 중국풍 제육복음 같은 느낌인데 고기도 많고 버섯을 비롯해서 야채도 풍성하다. 양도 많은편. 기름이 흥건한건 아닌데 음식양이 많다보니 좀 느끼해지는게 좀 아쉽다.
하이볼테라스,,#노원술집 맛있어요! // 국내에 10개만 존재한다는 하이볼 머신이 드디어 노원에도 상륙했다.분위기는 너무 떠들썩 하지도 조용하지도 않아서 부담없이 대화 할 수 있다.일본 산토리 본사와 콜라보한 술집인듯 한데 그래서인지 가성비가 좋고 퀄리티가 우수하다.진로 토닉워터 or 오리지널 토닉 선택이 가능한데첫방문이라면 오리지널 (일본 현지맛)을 경험 해 보기를추천한다.
장천,,"노원역 근처 생활의달인 출연 짬뽕이 맛나는 중국집매스컴에 나온 곳 중에 생활의달인이나 수요미식회는신뢰도가 없지는 않은데 이곳이 노원의 몇 안되는 곳방송에는 짬뽕과 사천볶음밥이 나왔다 하여, 짬뽕과 사천탕수육을 주문사천탕수육은 케첩베이스의 소스에 뒤로 살짝 매콤함이 스치고무엇보다 튀김의 바삭함이 상상초월요즘 탕수육 반죽이 꿔바로우처럼 쫀득하거나 일반 탕수육처럼 쫄깃하거나 둘중 하나인데이곳은 바삭함에 촛점을 두심 그러면서도 고기도 얇지않고 두툼하니 좋다짬뽕은,, 명성대로 국물 한스푼에 감동,,기름이 거의 없이 깊고 담백하며 깔끔,, 느끼하지 않고 시원 칼칼하다 면발도 쫄깃하니 ㅎ근처를 지나다 중식이 생각나면 한번쯤 가볼만한 곳 ㅎ"
설도,,
마들김밥,,
감나무아래,,"수제 계절차를 주문했는데 차고 넘치도록 채워주심. 자몽차, 생강차 모두 진하게 우러나서 건강해지는 맛이다. 4800원으로 가격도 저렴한편. 맞은편 스시준에서 식사하고 디저트 먹으러 가면 좋은듯. 직원도 친절하고 분위기도 조용한편. 여름엔 빙수가 맛있는 집이라고한다."
싸움의고수,,"다찌형 매장에 혼밥하기 딱! 족발정식이 8,300원매장 이름이 신기해서 한번쯤 가야지 했던 곳배달전문으로 생각했는데, 상권을 고려해서 매장구조를 혼밥용으로 세팅하셨다따뜻하게 삶은 족발, 보쌈, 삼겹살을 파채와 콩나물, 무절임, 백김치와 함께 도시락에 담아 낸다가성비가 좋다고, 양이 푸짐하다고 이야기 하긴 그렇지만,나름 퀄리티 좋은 재료의 식사를 적당히 먹었다 할 수 있음(다들 적게 먹고 사니,,  참아야지 ㅜ) 생각보다 족발 퀄리티가 좋아서 깜놀따뜻하고 잡내없고 야들야들 달달간간한 것이 딱 1인분 어치만큼 족발 먹고 싶을 때 괜찮을 것 같다"
미락칼국수,,"맛나고 양많고 가격착한 혜자로운 노원의 해물요리집인적드문 곳인데 이곳만 사람이 가득가득이곳이야 말로 동네 찐 맛집이다 싶어 고민고민하다 찾은 곳입에 착착붙는 밑반찬부터 솜씨를 짐작했고, 매콤달콤 양념에 탱클하니 연한 낙지볶음이 환상이렇게 실한 낙지가 가득 들었는데 2.0이라니,, 밥을 좀 추가하면 네명도 먹을 듯 ㅋ거기에 새우 바지락에 굴까지 들어가 깊고 시원한 맛의해물칼국수도 너무나 맛나다 ㅎ누구와 찾아가도 좋을 곳"
엄지냉면,,"#엄지냉면당고개역쪽~이전에는 이오냉면 이였는데~엄지냉면으로 바뀐곳4명이 오케이 만장일치~가쥬아~이집 맛집이다!!! (비냉3개 비냉세트로 1개 만두1  이렇게시킴 만두가 8개 각자2개씩 ㅎ)엄지냉면 맛집 만두피도 얇고 맛있당!!냉면육수따로 주는데 부어도 되고 그냥 마셔도 되공~ㅎ단골집인디 아~추억돋아 이모님이랑 오랜만에 봐서 안부인사여튼 이집은 말이지~만두 찍어먹는저 소스 간장이 예술이오~짠맛이 아닌새콤달콤~저건 뿌려서 수저로 먹는게짱!!!이집 진짜 맛있어 ~가서 묵어바~여튼 너무 맛있게 묵어서 행복해~ㅎ집에가서 뒹구르르르르르르담엔 가서  만두국  시켜묵어야징 ㅎ#위드인기맛집#""찐""맛집"
항아리수제비칼국수,,"식당 근처 사찰의 노승께서 맛있다며 꼭~ 한번 먹어보라 추천하셔서 들렀습니다.주문을 하면 그제서야 면을 뽑고 반죽을 뜯어 끓여 내오는 칼국수와 수제비는 감자, 양파, 당근채, 대파 같은 재료에서부터 갓 끓인 식감이 다릅니다. 게다가 그릇 바닥으로 그득한 싱싱한 바지락의 국물 맛은 숟가락을 멈추지 못하게 합니다.어릴 적 막내 고모가 얼른 한 그릇 먹고 가라며 끓여 내오던 바로 그 칼국수와 수제비 맛입니다. 그래선지 항상 미소를 잃지 않는 주방 사장님 얼굴에서 막내 고모가 슬쩍 보이기도 합니다.직접 담그신 열무김치와 겉저리도 식당 맛이 아니네요. 집에서 먹는 맛입니다. 칼국수와 수제비가 끓여 나오길 기다리며 먹는 열무 보리밥 고추장도 그냥 마트의 고추장이 아닙니다. 옛날 할머니네 것과 현대식(?) 고추장의 맛이 묘하게 썪여 있어요.사장님 남편 분께서 유명 미대를 나오신 조각가 라는데 제자들의 수채화 작품이 식당 벽 군데 군데 걸려 있는게 특이합니다.지하철 4호선 종점 당고개역에 내려 수락산이나 불암산을 오르거나, 덕릉터널을 통해 서울을 빠져나가 남양주나 포천으로 가는 길이라면 이 집에 한번 들러 보시기 추천드립니다. 스님에 이어 추천 릴레이를 하는 것 같네요 ㅎㅎ // 오랜 동네 맛집이에요-! 직접 반죽으로 주문할때 바로바로 면을 뽑으신다고 하셨어요. 수제비 칼국수 고민하다가 칼제비가 있어 선택. 콩국수도 여름계절 메뉴인데 드셔보신 분이 엄청 맛있다고 하셔서 너무 궁금했어요. 좀 늦은 점심시간인데도 혼자오신 분들도 많았고 자리가 꽉찬걸 보니 정말 동네유명맛집인가보다 했어요. 물론 맛도 굳굳이었어요. 국물이 너무 깔끔하고 조미료도 안들어가고 한 시원한 맛이 정말 좋았어요. 면도 쫄깃하면서 부드럽고 멀지 않으면 가끔 오고싶다 했어요. 가까우면 매일 먹어도 괜찮을 만큼 깔끔하고 꾸밈없는 맛이 좋았어요. 같이 나오는 보리밥도 별미로 먹었구요. 열무김치 배추김치도 직접 담그신 것인지 맛있게 먹었어요~ 사장님도 넘 친절하시고 웃으면서 서빙해주시는 모습이 기분좋은 식사여서 등록이 안된 식당을 구지 이렇게 등록신청하여 길게 써봅니다. 밀가루음식 애정하시는 분들 근처가신다면 추천이요."
청기와타운,,"힙한 분위기에서 먹을수 있는 갈비단체로 방문했는데, 가게가 넓어서 여럿이서 방문하기 좋은 것 같다.완전 프라이빗룸까지는 아니지만, 부스같은 것들도 많아서 가족 외식도 많이 하는 듯하다.소갈비를 1인분에 3만원 아래로 먹을 수 있다는 점이 좋았고, 맛있었으나 노란상 소갈비를 워낙 맛있게 먹었던 탓에 괜찮다..!로다만 육회가 정말 맛있었다.육회에 아보카도 배를 갈아서 같이 주고 위에 트러플을 올려주는데, 코스요리에 나오는 에피타이져 같았다. 완전 강추..! // 오픈해서 한 번 가 봤습니다.고기값은 하누소하고 비슷한데 반찬 종류를 거의 안 줘서너무 야박하게 느껴집니다.반찬이 돼지갈비 집 보다 못 합니다. 쌈 야채 1도 안 주고요 ㅠ생고기를 주문하니 육즙이 빠지네 어쩌네 설명을 하는데.결론은 알아서 고기 구워 먹어아하고 알바들만 많아서 뭔가 어수선한 분위기.네이버 리뷰는 무슨 이벤트를 쓰는지 ...저의 찐 후기... 비추 입니다. 다신 안갑니다﻿"
서울집,,"을지병원 옆, 나름 오랜 역사를 갖고 있는 한우소머리국밥날이 계속 춥다보니점심이면 뜨끈한 국물만 계속 생각나는데, 근처에서 보기드문 한우소머리국밥집 발견 ㅎ꽤 오랜시간 정성으로 끓여야하는닭곰탕과 옺닭도 판매하시는 걸 보면,음식 허투루 하는곳은 아닌듯양념없이 뽀얗게 우려낸 구소한 진국에, 부위별로 다양하게 푸짐히 들어간 고기들은잡내없이 탱글하니 연하다연한 된장에 찍어먹는 양파도 달달하니 맛나고,시원하고 매콤한 배추김치와달달하게 아삭한 석박지도 곰탕과 잘 어울림추운날, 속까지 따뜻하게 해 줄 곳을 또 하나 발견했다"
낙원,,어제 유투브 광마니님이 집에서 짜장 먹는걸 보고..난 짜장곱빼기를~연신 문자를 보냈고자다 일어나서 ~^^소원성취!!ㅋㅋㅋ괜히 유투브를 봐가ㅈ지겅 ^^;;아~맙소사~원체 먹두리를 자주보는데 이번에는 광마니편이떡하니 떠있고~^^안볼수없어 보다가나도 먹고싶다 먹고싶다..침이 고이기 시작하고금단증상같은것이 ..자고있다가 벌떡 일오나서내 짜장면 시켰엉?ㅋㅋㅋ곱창먹은후 암것도 먹지않아 배가 무쟈게 고팠고짜장은 곱빼기는 먹어줘야 한다는 ~따라하고 싶은 먹방러들의 면치기 입한가득 넣고 씹어넘기기를 ~아 아~행복하다 ㅎㅎ이거죠~면이 뿔어서~딱 좋게 양도 더 푸짐해졌고아이구 맛있엉~뿔어도 맛있네영근댕 이거이거ㅜㅜ 깐풍기 시큼한 냄새가 과한것이^^;;가격도 35000원이면 좀 비싼듯한~한두개 집어먹고 다들 젓가락을 놔버렸네요..ㅜㅜ내가묵어?ㅎ 저도 도전했다가 두개먹고 못묵었어영 ㅋ만드실때 식초가 과하게 들어간듯 싶습니다~식초 잔뜩 넣은거 좋아하는 저인데..이번꺼는 요리가시큼한것이 쉰듯한 느낌을 받아 안넘어 가는거 같아영볶음밥은 밥알이 꼬슬하긴 허나 간은 안된듯 하구영전 볶음밥은 야채 다 같이 볶았으면하는^^ ㅎㅎ작은 소망들이 있네요 ~그냥 짜장곱빼기 잘 먹은거로만족하겠습니당~ 으앗!!5월은 가족이랑 맛있는거 잔뜩먹고 행복합니다~그저 바램이 있다면 모두 건강하길..한주 시작 화이팅 입니다!!좋은일 가득가득  하세영~쿠폰을 6개나 쥬시는군요~쿠폰 모으는 재미도 좋지영#항상함께해
남자서른,,"공릉에서 테라스 술집에 가게 된다면 여기가 정말 좋은 것 같아요! 자리도 나름 많이 있고음식 맛도 괜찮아요!약간 토마토스파게티 국물버전 같은데 자극적이지 않아서 계~~~속 들어가더라구요! // 개안음 // 공릉 데이트 장소로 추천하는 술집!이곳은 공릉 철길에 위치한 술집입니다. 최근에 건물을 새로 지어서인지 층고도 높아지고 테이블도 많아져 더 쾌적해진 느낌입니다! 콜키지도 되고 분위기도 좋아서 커플 분들에게 더 추천드립니다!!주 메뉴는 토마토탕면과 모츠나베입니다. 저는 토마토탕면과 떡볶이를 주문했습니다~ 사실 두 메뉴 다 막 특별한 맛은 아닙니다ㅠ 그치만 양도 많고~ 술 마시기에 좋은 안주라는 점은 아주 좋았습니다!! 예전에 방문했을 때 조개 술찜을 정말 맛있게 먹은 기억이 있어서 그 메뉴를 가장 추천드립니다!! // 원래 이 자리엔 굉장히 맛있던 이자카야, ""히게즈라"" 가 있었다. 그런데 지금은 ""남자서른"" 이라는 술집으로 바뀜.안주는 만원 대로 가성비는 괜찮은 편이다.근데 오지치즈후라이는 너무 마요네즈 맛이 심하고 느끼해서 별로였음.안주 메뉴를 프로젝터 빔으로 벽에 띄워놓으시는데 안주가 종종 바뀌는 것 같다.바깥 테이블은 철길이 보이고 운치있는데 안 쪽은 우중충하고 좀 별로다. 그냥저냥 괜찮은 술집."
금쪽,,
신설국,,하계역 인근 서울온천 바로 옆 건물에 위치한 정통 일식 전문점.인테리어 훌륭한 고급진 분위기의 넓은 홀과 다양한 인원이 함께할 수 있는 프라이빗한 룸들이 준비되어 있는 대형 음식점으로 우리만의 편한 식사가 가능한 곳이다.그렇다보니 가족 모임이나 회식하기 좋은 곳으로 메뉴도 여러 금액대로 나뉘어 있고 모두 알차게 구성 되어 있다.모든 음식 맛있고 훌륭한 편이며 특히 사시미의 경우 숙성 잘 시킨 여러 종류별의 큰 생선을 취급하기에 식감이 매우 좋고 맛이 좋다.에피타이저 부터 메인 메뉴 그리고 곁가지 음식 까지 다양하며 풍성한 여러 음식들의 개별적인 맛을 즐기면서 만족스러운 식사를 할 수가 있다.인근에서 일식집을 찾는다면 충분히 만족스러운 곳으로 모든 직원 친절하고 주차는 서울온천 빌딩에 하면 두시간 무료로 이용 가능하다.
신당동즉석떡볶이,,오늘 바람이 무쟈게 마이 불었어요^^가다가 급 땡겨서 먹었는데~떡볶이가 맛있어섭~^^어묵이는 덜 뿔어서 별루지만국물은 맹탕이지만떡볶이는 맛있더군요~양념도 맛있었어용이집은 대체적으로 간이 강하지 않아서부담없이 즐길수 있으실꺼 같아영~바람이 씨다보니 연신 머리카락 싸대기 맞으며먹는 떡볶이 맛은 추억 그 자체~ㅋㅋㅋㅋ단발이라..이눔의 머리카락 ..먹방시 고무줄은 필수인데것도 안가져왔어 ㅎㅎㅎ추블때 먹으니 이것참 맛있군하♡오징어튀김 오랜만에 먹어봤는데 맛있어영~튀김옷이 딱딱이가 아니라서 좋았어영~^^적당히 먹기좋은 튀김옷~순대를 못묵어봐서 아쉽군..ㅜㅜ
크라운호프,,"특별히 뛰어난건 없지만 부족한것도 없는 곳. 1차보다는 2차로 들려서 간단하게 먹기좋은 곳. // 주문한 메뉴 정확히 기억안남..서빙 오는동안 맥주가 막 넘치고 있길래 넘친다고 몇번을 얘기했는데 그걸 테이블에 그냥 놔버림. 그러고 넘친거는 내가 다 휴지 계속 뽑으면서 닦고 있었고 서빙한 사람은 멍하니 쳐다보기만 하고 말한마디 없이 그냥감. 서비스가 최악. 상식적인 서비스를 제공하면 좋겠음. 알바가 아닌 사장같았음 // 작년 여름쯤 새로 생긴 동네 호프집. 핑거푸드와 생맥을 메인으로 팔아서 2,3차쯤 가기에 안성맞춤~ 우린 너무 배가 불러 문어구이와 생맥만 주문. 맥주 절친인 피자와 치킨도 꽤 많이 드시는 듯~ 문어 솔직히 살짝 질기긴 했지만 bad 라기 보다는 not good. 다른 어떠한 메뉴도 추가로 시키지 않았으므로 음식은 평가할 수 없을 거 같음. 맥주는 바로 엄지척! 크아아 쌍따봉! 카스 생맥과는 또 다른 맛으로 밀레니엄 시절의 통닭집 맥주맛을 연상케 한다.총평: 크라운생맥주 한 잔이면 행복지수 업~ 옛날 맥주맛!"
진짜루,,그냥. 중국음식 땡길 때 간편하고 져음 // 3명이상가면 군만두섭스로주세요 가격괜찮고 맛도나쁘지않아요 짬봉맛있어요 ㅇㅇ
인생닭갈비,,
