restaurant_name,score,reviews
에이엔,,"내 미각이 고장난 게 아닌가 싶었던 식사…런치 3만원의 가성비 좋은 오마카세이지만 아쉽게도 내 입맛에는 맞지 않았던 것 같다. 공통적으로 쓰인 샤리가 나한텐 너무 시고 맛이 강해서 계속 네타의 맛을 방해해서 안타까웠다.내가 유독 신 맛에 약해서 그런 것일 수도 있고 내가 스시를 다양하게 많이 먹어본 게 아니라 이곳의 스시가 엄연히 하나의 스타일인데 이해를 하지 못한 것일 수도 있다. (장희님과 함께 방문했는데 장희님은 맛있게 드셨다고 하셨으니 이것만 보지 마시고 다른 리뷰들도 참고해주세요!)제일 먼저 주시는 차돌박이 샐러드가 너무 환상적으로 맛있어서 신이 났다. 차돌박이를 직화해서 불향이 진하게 나는 고소한 샐러드였다. 그런데 이게 이날 코스 중에 제일 맛있게 먹은 메뉴일줄이야…ㅠ그 다음에 나온 광어 사시미는 활어회처럼 쫄깃한 것도 아니고 숙성회처럼 부드러운 맛도 아니어서 애매하게 느껴졌다. 너무 질겨서 좀 더 숙성돼서 부드러웠으면 좋았을 것 같다.그 다음엔 14개의 스시가 나오는데 문제는 밥의 식감과 간이 조금 이상하게 느껴졌다. 그리고 피스마다 샤리가 쥐어진 정도나 맛이 고르게 느껴지지 않았다 (일부러 각 생선에 어울리는 스타일로 샤리를 달리 하는 디테일이었을까?). 일단 밥이 너무 시큼하고 왠지 모를 씁슬함까지 느껴졌다. 밥알도 내 취향에는 너무 단단했는데 찰기가 많이 없는지 일부러 덜 견고하게 쥐시는 건지 어떤 피스는 샤리가 부서졌다. 내가 특히 맛있게 먹은 건 가리비관자와 단새우였다. 살이 엄청 부드럽고 달달했다. 과하게 시큼하고 쓴 밥맛이 그 달달함을 덮치는 것 같아 속상했다.이외에 금태도 부드럽고 맛있었다.불을 잘 쓰시는 것 같다. 앞서 나온 샐러드의 직화 차돌박이처럼 방어 지느러미, 삼치 등 아부리한 피스들이 향이 좋았다.간재미, 청어, 고등어 등은 비린 향이 좀 났다.바다장어는 가시가 다 제거되지 않았다. 남아 있는 게 얇은 가시들이긴 했지만 눈에 보이고 씹히지 않는 가시들이어서 거슬렸다. 마지막에는 무난한 계란, 국수가 나오며 점심 코스가 슬슬 마무리 되는데, 디저트로 나온 녹차 아이스크림은 내가 생각하는 녹차 아이스크림 맛이 아니라 특이하게 일본 팥 아이스크림 맛이 났다. 예상했던 것과 맛이 다른데 그와 동시에 알고 있는 맛이 나서 이상했다. 맛이 없는 건 아니지만 분명 초록색 아이스크림을 먹고 있는데 핑크색 팥 아이스크림 맛이 나니 인지부조화가 일어나는 것 같았다ㅋㅋㅋ식당은 깔끔하고 셰프님도 조용한 스타일로 친절하셨다. 스시에서 이 정도로 강한 신맛을 느끼는 게 너무 이상해서 이날따라 샤리의 상태가 평균에서 많이 벗어난 것이든 내 미각 상태가 이상했던 것이든 다시 먹어보고 평가하고 싶지만 재방문은 없을 것 같다.하지만 분명 좋은 가격에 양질의 식사가 준비되어 있고 오마카세는 이 근처에서 찾기 어려운 종류의 식당이니 근처에 사는 분들에게 한번쯤 가보시길 권하고 싶다. 의도치 않게 너무 안좋은 리뷰를 한 것 같아 죄송하지만 이날 같이 방문했던 장희님은 맛있게 드셨다고 하셨으니 아마 취향의 영역이었을 확률이 높다. 에이엔에 대한 좋은 리뷰들도 많으니 모두들 꼭 참고해주셨으면 좋겠다. // 노원 유일의 오마카세 스시집. 런치3만 후식까지 15종이 나온다. 별기대 안하고 갔는데 첫 광어부터 맛있었다. 차돌샐러드, 광어3피스, 농어, 벤자리, 금태, 한치, 줄무늬전갱이, 엔가와, 단새우, 청어, 관자, 고등어 봉초밥등. 가장 좋았던 건 엔가와랑 금태. 특별히 비싼 식재료가 있진 않았지만 만족스러운 식사였다. 바다장어 가시가 약간 남아있던건 거슬림 // 재방문의사 100 % // 공릉동에 갑자기 나타난 오마카세 전문점. 한자로는 영원 일어로는 에이엔 :) 인테리어가 깔끔하고 이쁨. 전복내장죽으로 시작해서 끊임없는 숙성회/스시/해산물/도미지리 파티 후 관서식카스테라-녹차아이스크림까지 끝없이나옴주의! 귀한 우니와 안키모도 충분히 나온다. 혼자 알고싶지만 앞으로도 계속 찾아올 수 있도록 여기가 가게 이름처럼 오래오래 번영했으면 하는 마음에 리뷰남깁니다. 대접 잘 받고왔네요 맛있었습니다. 재방문 예정. 주차가능."
홍대개미,2.9,"매운새우덮밥 스테이크덮밥 세트 시켰습니다. 분명히 안 맵게 달라고 했는데 혀가 아픈 매움으로 주셨습니다. 일단 양이 너무너무 창렬입니다. 평균 12000원인데 그 값어치를 하는 메뉴는 없다고 봅니다. 양이 적으면 맛으로 승부를 봐야하는데 맛은 여기 뒷골목에 9900원 일식 덮밥이 10배 더 맛있습니다. 진짜 기대할 필요도 없고 딱히 먹을 이유도 없는 가게 입니다. 가더라도 매운 계열 음식은 절대 시키지 마세요. 다시는 안 갑니다 // 롯데백화점 식품 코너에 위치한 홍대개미점심식사로 포장하려고 둘러봤는데 제일 문안한 곳이 여기였어요. 대창은 금방 딱딱해질 수 있다고 30분 이내에 먹으라고 하시더라구요. 30분 후에 먹었는데도 쫄깃쫄깃하니 여전히 맛있었어요 ㅎㅎ 대창 좋아하시면 만족하실만한 퀄리티에요.연어덮밥은 연어가 신선한 편이나 양이 조금 부족하여 밥이 조금 남았네요.포장 손님이 많아서 5분 정도 기다렸으나 여전히 포장해서 먹기 좋은 메뉴같아요. // 스테이크 덮밥. 질기고 양념부족하고 숙주너무적고 전체적으로 별루 // 깔끔해서 괜찮았음 // 2018.06.27허억 ㅠㅠㅠ 너무 맛있다. 감격적인 맛!메뉴는 8개인가 9개인가, 그정도 있던 것 같은데 뭔가 검색했을 때 큐브스테이크덮밥이 많이나오길래 메인메뉴인가 싶어서 주문..특이하게도 자리를 먼저 잡아야 주문을 받아준다...평일5시반에 갔을때는 자리 꽤 널널한 편이었다... 백화점 푸드코트에 있어서 조금 정신없는 분위기였다. 그래도 완전 맛있었고 다음엔 목살슬라이스덮밥 먹어야겠다.."
제임스키친,,"노원에서 분위기 적당 맛 적당한 양식을 찾는다면 매우 괜찮은 선택지. 스테이크가 기대보다 맛있었고, 뇨끼도 맛있다. 다만 마르게리따 피자는 별로. 그래도 가성비와 분위기와 맛 사이 균형을 잘 잡은듯한 식당. // 스테이크 정말별로다 ㅋㅋㅋ친구가 먹고싶대서 시켜줬지만 이런곳의 스테이크는 집에서 구워먹는거보다별로당 ..ㅎ한입먹음돈없을때 로제파스타 먹으러갈곳!!여긴 로제파스타만 맛있다 가성비 좋아서 좋고다른건 다 별루당근데워낙 노원에 파스타 맛집이없어서 영화보고 한번쯤 가게됨ㅎㅎ너무 비평같이 썼지만 먹을만하다^^ㅎㅎ❤️배고픈데 돈없고 동생이랑 배채우러가기좋은곳누구한테 추천은 절대안함 ㅎ서가앤쿡 같은곳..오일파스타 시키지마세용집에서해먹는게 더 맛있음아 에이드도 비싸기만해요 저렴하게 탄산시키세용 ㅎ // 내 입맛엔 어글이스토브보다는 이 집이 백배 괜찮다. // 엥~ 별루 // 파스타 2개+ 샐러드 세트 먹었다.식전빵이 나오는데 따뜻하고 부드럽고 발사믹도 맛있음.훈제 치킨 샐러드도 양이 적지만 괜찮았음홍게 로제 파스타랑 비프 페퍼 파스타 시켰는데 로제 파스타에 게살도 꽤 많았지만 맛은 쏘쏘..양은 남자기준 좀 적긴 했지만 파스타는 어디든 그런듯"
쯔이코,,"야근으로 근처에서 밥을 해결해야 했다. 부장님과 기분좋게 맛있는거라도 먹자해서 망플찬스로 검색~진작에 이 집을 검색해서 알고 있었으나 번번이 문을 열지 않아 발길을 돌리곤 했다. 사실 그 날도 이곳이 목적지가 아니었으나 지나가다가 문을 연것이 신기(?)하고 반가워 얼른 들어갔다!밥때가 애매하여 손님은 우리테이블 밖에 없었고 사실, 메뉴까진 검색하지 못 하여 뭘먹어야 하나 고민고민...블로그까지 검색해보니, 밥 때면 줄을 서서 먹어야 한다고..잘 맞춰서 왔네~:)결국 메뉴에 추천이라고 되어 있는 메뉴 한 가지와(야끼도리동-8,000),  에비동(8,000)을 시켰다.에비동은 새우와 돈가츠가 올라가 있는 덮밥이고, 야끼도리동이 생소했다. 그런데 역시..왜 추천메뉴인지 한 숟가락 넣자마자 바로 감탄사가 나도 모르게 터져나왔다. 으~~~~~음!ㅎ불맛과 함께 여러 블로그에서 극찬했던 부분이 뭔지 금방 알겠더라는.. 이 집만의 특제소스 같은 매콤한 맛이 불향과  함께 조화를 이루어 너무나도 맛있었다. 정말...혀는 정직하다. 맛있는것과 없는것을 금방 알아차리니. 눈으로 화려함에 현혹되다가도 금방 한입 입에 넣으면 그 화려함이 진짜였는지 거짓이었는지..같이 간 부장님도 이 집 맛있다고. 애써 한 숟가락을 남겼다. 양심상 다이어트 중이니....ㅎ // 맛은 진짜 있는데 여는 걸 못 봤다 특히 저녁에는인스타를 안 하는 나로서는 포기하는 수밖에 ㅠㅠ // 일본 가정식 덮밥집. 유명하다는 치즈 추가 야키도리동과 에비동을 시켰다.에비동은 튀김옷이 아주 바삭하다던지, 밥알이 아주 고슬거린다던지 등의 특별히 인상깊었던 점은 없었지만 간도 맞고 대체적으로 맛있었다.대표 메뉴 야끼도리동은 매콤한 닭고기 덮밥인데 그 소스가 아주 매력적이진 않았다. 고추장이 들어갔는지 살짝 텁텁한 이 소스에서는 칠리같기도 하고 케찹같기도 하고 카레같기도 한 익숙하지만 색다른 향이 났다. 주택가 상가에 위치 해 접근성이 떨어지는데 이 동네에 다시 갈 일이 있더라도 또 찾아가진 않을 것 같다. 하지만 귀엽고 따뜻한 인테리어 속 뜨끈한 덮밥 한 끼 먹을 수 있었음에 만족한다. // 매장은 작아서 테이블간 간격이 좁은건 단점이었으나 가격이 상당히 저렴하다. 6000~8000 일부는 9000원정도였던걸로 기억. 2천원 추가하면 곱배기가 가능했다.가츠동이랑 야끼도리동 먹어봤는데 맛있었다. 위에 뿌려주는 소스?가루?같은게 좀 인상적이었다. 오 존맛 이정도까지는 아니나 맛있네 하면서 먹을수있을정도. 그래도 가성비가 좋아서 만족스런 식사였다. 자주 갈 듯하다 // 삼치덮밥. 조린 삼치위에 후리카게가 잔뜩. 밥은 약간 모자란편이지만 요청하면 더준다. 평일 점심에 갔는데 웨이팅도 좀 있었다."
스시웨이,,"배부르게 먹을 수 있음 퀄리티는 36000원짜리에 딱 2피스 괜찮고 그나마도 밥은 떡짐. 가격대비 가성비 없음 19000원 세트도 신촌가면 딱 12000원에 먹을 퀄리티고 36000원 세트는 진짜... 시키지 마세요 ㅎㅎ 리뷰마다 식탁 끈적거린다더만 정말 끈적거려 // 28,000원짜리 B코스 시켰는데 배터지게 먹었어요. 다들 초밥집은 갈데 없는 노원에 가격대비 양과 질이 나쁘지 않아 가격대비 괜찮다고 하더니 정말 그랬어요. 19,000원짜리 A세트는 너무 기본만 나올거 같아서 B 세트 시켰는데 다양하게 나와서 재미나게 배부르게 먹었어요. 처음에 브로콜리 슾은 오뚜기 맛이여서 웃었는데 가격대비 맞추려면 뭐 스프정도 오뚜기여도 좋다 라는 생각이 들었어요. 가족끼리 너무 고급 초밥일 필요없고 그냥 괜찮은 동네 초밥집가고 싶으시다면 추천입니다. 토요일 7시 20분 도착했는데 2명은 20분 3명이상은 30분이상 대기 있었어요."
시드누아,3.2,"노원역 터줏대감 카페오래된 카페라고 들었는데 역시 여기가 본점이고최근에는 속초에도 분점을 만든 모양이다가게 규모가 크다 1층엔 음료가 나오기까지 대기할 수 있을 만한 큰 테이블이 하나 있고 지하랑 2층에 자리가 많다우리는 바닐라빈 캐모마일과 오가닉 루이보스, 앙버터 프레첼 이렇게 세가지 주문했다바닐라빈 캐모마일은 캐모마일에 바닐라빈의 단 맛이 들어가서 오묘하면서도 맛있었다 은근 둘이 잘 어울렸다오가닉 루이보스는 그냥 루이보스 맛앙버터 프레첼은 기본 앙버터인데 빵을 프레첼처럼 구웠나보다겉에 소금으로 간을 해둬서 단짠을 즐길 수 있는 빵이었다전반적으로 대화 소리가 조금 울리는 공간이었지만넓고 쾌적하고 베이커리도 종류가 많아서 잠시 머물기에 좋은 카페였다 // 한 4-5년만에 다시 가 본 시드누아. 친구랑 지나가다 추워서 오랜만에 여기? 하고 들어가게 됨 인테리어 아웃테리어 메뉴 모두 바뀌어있어서 음 바뀌었군 했는데 커피 종류가 없어도 너무 없어서 선택권이 없이 불랙커피로.. 빵은 안 먹어봐서 모르겠지만 비쥬얼 상으로 딱히 맘에 드는게 없어서 안 시켰고, 필터커피는 정말 너무너무 맛이 없었음ㅜㅜ 진짜 2000원짜리 저렴이들보다도 못한... 충격 게다가 지하는 난방 안 된다고 2층 이용하래서 2층 갔는데 대화 안 될 정도의 재래시장st 소음에 난청올 듯 했음;;; 예전에 쇼파도 이렇게 불편하지 않았던 것 같은데 쇼파 등받이도 불편하고.. 보여주기식 인테리어 싫어요... 총평: 아묻따 다시 안 갈 듯.... 실망... // 앙버터브레첼 열심히 먹었엇음 근데 가끔 뒤지게 짠 날이 있음..음료는 잘 안먹었어서  잘모름 // 저번에 괜찮았던 것 같아서 한번 더 방문해봤다 이번엔 2층으로 올라가 이용했고, 너트커피와 아이스 블랙커피, 레몬빅토리아케이크 주문했다 근데 이번 방문은 좀 별로였음ㅠ일단 너트커피는 땅콩버터맛은 많이나는데 이 맛 자체가 산미있는 원두와 어울리진 않는 것 같다 솔직히 좀 별로ㅠ 크림이 차라리 꾸덕했으면 아인슈페너처럼 마시고 좋았을 것 같은데 그냥 묽어서 섞어마시는 커피라 아쉬웠다블랙커피는 산미가 좀 있는편인데 이게 너트커피보다 더 맛있었다 저번엔 무난한 음료들인 민트티와 블랙커피를 마셔서 괜찮다고 생각했던 것 같음레몬빅토리아케이크는 레몬의 신맛은 있으나 상큼이 아니다 그리고 레몬크림자체에서 계란 비린내가 많이 난다 이 비린내때문에 레몬크림부분이 최대한 없이 먹어야 먹을만하다 상큼한 케이크가 먹고싶어서 고른 건데 아주 실망스러웠고 케이크 자체가 좀 오래된 퍼석한 느낌이었다 맛없었음.저번 방문때도 느꼈던 거지만 리뷰엔 남기지않았던 내용들도 이번엔 남기자면 화장실의 남녀를 그림으로 표시해놨는데 한눈에 구분이 잘되진않는다 남자친구는 이것때문에 화장실 갈 때 아주 헷갈린다고 불만을 표했음ㅋㅋㅋ 그리고 지하든 2층이든 와이파이가 안된다 영수증에는 건물구조상 문제라고 명시되어있지만 그냥 카공족을 방지하려고 설치 안 한 것 같기도..ㅋㅋ저번엔 음료도 케이크도 무난한 걸 골라서 괜찮았던 것 같은데 이번엔 넘 별로인 메뉴들만 먹어서 앞으로 재방문은 안 할 것 같다ㅠ 사실 가격도 그다지 저렴한 편은 아닌데 그냥 넓직하니 좋아서 왔던거라… 노원에 다른 괜찮은 카페 발굴해내야겠다...블랙 커피 ICED (₩4,500)너트크림 라떼 (₩6,500)레몬빅토리아 케이크 (₩7,000).맛 ★가성비 ★★★총점 ★★ // 노원역 인근에서 가본 곳 중 가장 크고 줗더라고요! 음료는 평범하지만 넓고 천고도 높고 인테리어도 잘 되어있어요. 1,2층 다 카페이고 평일에도 손님이 많아요. 주차 공간은 따로 없어요."
하나샤브샤브,,"한 줄평 : 깔끔하고 담백한 편백찜과 샤브샤브를 동네에서 먹을 수 있는 것도 복6년 째 단골, 세이로무시 (편백찜)을 하는 곳이 요즘 많지 않다, 있더라도 강남 압구정 쪽만 가도 적은 양에 종류도 많지 않고 비싸기만 더럽게 비싸다.하나샤브샤브는 노원구 쪽에서 아는 사람들은 또 찾아간다는 나만 아는 맛집 느낌.분위기 또한 좋고 사장님 또한 친절하다.항상 편백찜만 먹다가 처음으로 마감시간 가까이가서 의도치않게 샤브샤브를 먹었는데 왠 걸 이 것도 괜찮네???채소육수라 부담또한 없고 양이 전혀 부족하지 않다.야채 신선하고 고기도 바로바로 정육해서 주시니맛 없을리가 천부당만부당하다.다만 아쉬운 건 여기 사장님이 한 번 바뀌었었는데,그 이후 야채 가짓수가 퀄리티가 한 번 싹 낮아지고규동의 소스또한 바뀌고, 멘타이쥬의 밥에 섞여있는 다시마의 그럼 섬세한 퀄리티의 감동은 사라졌다.최근 다시 찾은 요즘 그래도 초반 하루 샤브샤브의 퀄리티를 다시 찾아가는 것같아서 만족스러움.사실 여기 우유푸딩이 jmt인데 이제는 초코푸딩만해서 너무 아쉽다.단골로서는 6년 전 하루가 그립다… // 여기 마시쒀요근데 좀 습해요 ㅋㅋㅋㅋㅋㅋ근데 후식이 마쉬쒀요 특히 주스 꼭 드세오 // 이근처로 이사를 오게돼서 인테리어 공사하는거 보고 조금 늦은 시간인 8:40분에 가게에 도착했어요. 마스크를 쓰고있었지만 마스크위로 보이는 직원분의 떨떠름한 표정을 아직도 잊을수가 없네요. 9시까지 메뉴마감이라고 하시고는 메뉴판을 안주셔서 가지러갔었고 제가 직원분께 불친절하거나 불쾌하게 대하지도 않았는데도 계속되는 불친절함에 불편했습니다. 그래도 들어왔으니 음식을 시켰어요. 샤브샤브+세이로무시세트4인 시켰구요. 맛은 있었는데 늦게간게 그렇게 잘못인가 싶네요. 10만원넘게 주고 눈칫밥 먹고온 기분입니다.  가게의 분위기나 음식맛은 좋습니다. // 재방문의사100%이제까지 먹어 온 샤브샤브가 아닌 이 집만의독특한 방식의 야채 육수 그리고 싱싱한 제철 야채와좋은 등급의 블랙앵거스 소고기.재료를 그대로 편백나무통에 삶아서 재료 본연의 맛을 제대로 보여주는 세이로무시.일본식 퓨전 샤브샤브 그리고 세이로무시.셋트에 나오는 토마토절임샐러드와 명란덮밥, 불고기덮밥그리고 후식 수제 푸딩과 헤이즐넛커피까지.배부르게 식사 한끼 먹기도 술잔 한잔 기울이며 안주로 먹기에도 아주 좋은 샤브샤브 집. 데이트에도 먹방에도 손님 접대에도 아주 좋은 곳이다 .맛도 분위기도 인정.점심시간 가성비가 아주 좋은 곳이니 점심시간에 가실 수 있으면은 점심시간 가시는것을 추천.참 맛있다. // 여기 식당을 와서 처음으로 세이로 무시를 먹었어요 사람만날때도 첫인상이 중요하듯 새로운 음식도 처음 먹었을 때의 느낌이 중요하다고 생각하는 사람인데, 오늘 먹은 세이로 무시의 첫인상은 신선한 느낌이였어요. 세이로 무시가 나무 판에다 채소와 고기를 올리고 쪄서 먹는 음식이라 그런지 매우 건강한 맛이 났어요. 공간 자체가 고급스러운 분위기가 나서 연인이나 가족 행사에 오면 좋은 곳인것 같아요!"
스시쟁이,,"곰군(?)이 인정한 맛집이라던데 누군지 궁금했네요. 근처 사는 친구가 맛집이라고 추천해서 방문해봤는데 가성비가 참 좋은 집이라는 인상을 받았습니다오늘의 초밥 주문했습니다. 초밥이 실하고 회가 큼직큼직했네요. 샐러드 장국 우동도 같이 나옵니다. 여름에는 우동 대신 모밀국수가 나온다고 해요. // 이런 피스를 돈 받고 팔다니.... 살다살다 이런 참치 처음 봤어요.한 사람에 16,000원 정도 하는 플레이트였는데, 참치 ""특"" 이라면서 이딴 참치를 내오다니.... 일본에서 8년 살다온 자로서 판단컨대슈퍼마켓에서도 쓰레기로 버리는 피스고 회전 스시집에 가도 안 볼 비주얼이거든요. 해괴망측함 진짜.... 심지어 제가 베푸는 자리였는데 너무 충격받고 화나서 바로 불러서 다시 가져가달라, 이런 참치는 절대 안 먹고 싶다. 제대로 된 피스로 다시 달라고 했더니 또  바로 멀쩡한 피스 주시는 것?....???????일단 아무렇게나 쓰레기까지 내 준 다음에 불평하는 사람은 제대로 된 걸로 바꿔주고아니면 먹어라 ㅋ 하는 심보인가?다시 바꿔준 건 무난했습니다만 이 돈 주고 먹을 맛은 전혀 아니에요. ​ // 맛이 많이 변했어요… 사장님이 바뀌신건지 초심을 많이잃었어요.. 그리고 서빙하는 여성 알바분 너무 불친절하세요… // 공릉에서 제일 가성비 좋은 초밥이 아닐까 싶어요!! 배달로도 자주 시켜먹는데 초밥 배달 상태 좋기 쉽지 않은데 배달로 먹어도 좋고 가서 먹으면 더 좋습니다! 식당은 작지만 사장님께서 어떤 초밥이 더 신선하다고 친절하게 추천도 해주시고요~~ // 석계스시쟁이 맛있어서 갔는데 어려보인다고 서비스 뭐같이하고 심지어 신선도도 떨어지고 맛도없었음 ㅠ"
달밭소곱창,,사장님도 친절하시고 완전 맛있게 잘 먹었어요! 모둠 시켰는데 다음에 또 오려고요 ㅎㅎ // 소문듣고 첨왓는데 사장님도 친절하시고넘나 맛잇네용 !!!오랜만에 새로운 맛집 찾아서기분 넘나조음ㅋㅋㅋ // 곱창3인분 치즈처럼입에서 사르르녹습니다 // 소곱창 2 소대창 1 = 사랑입니다이정도 곱찬데가 없어뇨 // 너무 친절하시고 맛있어요!!
잔월,,"공릉역에 대로변 지하에 위치한 이자카야에요. 학생들로 정말 엄청 북적여서 자리가 없나 싶었는데 다찌 같은 곳에 자리를 내어주셨어요. 꼬치 모둠이랑 야끼 우동 같은거 주문해서 먹었는데 둘 다 맛은 평범한 편? 야끼우동에 들어간 해물들에서 좀 냄새가 나는 편이라 그게 아쉬웠어요. 꼬치가 차라리 나쁘지 않았던 기억이에요. 근데 알바분께서 일한지 얼마 안되셨는지 부루스타 줬다가 치우고 앞접시 두번 주고 이런게 많아섴ㅋㅋㅋ 재밋었습니다 나름... 공릉이라면 또 오겠지만 공릉에 또 올 일이 있을까 싶네요..? // 개안음 // 공릉동에서 가장 애정하는 술집이다. 소고기 타다끼는 맛도 맛이지만 가격대비 양이 많다. 다른 메뉴도 계속 도전해 보고싶은 곳이다. // 연어사시미꼬치구이 시켰는데연어사시미 플레이팅이 맘에 들어서 더 맛있게 먹었어요연어 맛은 괜찮음과 맛있음 사이였어요꼬치는 베이컨,닭껍질,닭가슴갈 꼬치구이 먹었는데정말 맛있었어요..베이컨에 메추리알, 호박 넣은 꼬치는 최고!맛있습니다 // 친구랑 친구여자친구 놀러와서 깔끔한 곳에 술한잔 하려구 급하게 망고플레이트를 켯는데 1위로 뜬 곳이 여기다. 후다닥 가서 육회시켯는데 냉동인데 해동이 이상... 진짜 별로여서 매우 민망햇다ㅜ 베이컨토마토꼬치는 맛잇엇는데.. 사실 맛없을 수 없는 안주..."
나우키친,,부채살 팬스테이크 존맛! // 다양한 메뉴에 셋트메뉴가 있어 부담없는 가격에 스테이크응 먹을 수 있다. 스테이크 먹은 후 밥은 볶을 용도이고 그 밥이 별미이다. 팬스테이크라 레어를 시켜도 미디움레어가 되니 주문할 때 참고. // 18-97저렴한 스테이크팬 스테이크라는 조금 생소한 메뉴를 들고 온 나름 오래된노원의 스테이크 맛집입니다만원대에 질 좋은 스테이크와 볶음밥을 먹을수 있고 식전빵과 나름 개성 강한 팬라이스와 파스타도 좋습니다살짝 매운맛이 감도는 여기만의 특제 소스는 스테이크를 찍어 먹어도 좋고 팬라이스에 넣어어 볶음 밥을 안들어 먹어도 좋습니다아쉬운건 팬 스테이크다 보니까 고기의 시즈닝이 내 마음대로 되기도하지만 안되기도 한다는거..그래도 가성비 좋고 맛있어서 가끔 들립니다방문추천  85%서비스 80%청결 75%주차는 지하주차장에 가능하나 기계식이라 길가공영주차장 추천합니다
