restaurant_name,score,reviews
털보고된이,4.0,"점심에는 줄 서서먹는 식당!체인점이라 다른지점은 가봤는데이번에 본점으로 가봤어요!정식A로 고등어 + 제육 + 우렁된장 먹었는데여자 둘이서 먹기에는 양 진짜 많아요! 다음에는 그냥 세트말고 각각 으로 시키려구요ㅠㅠ고등어 비린맛도 안나고 살도 너무 부드럽게 발라져서 맛있어요! 간장과 와사비섞은거랑 왜이렇게 잘어울리는지~~제육도 기본적인 맛으로 호불호 없을 것 같아요!고등어 먹다보면 약간 느끼한데우렁된장이 얼큰해서 국물 한번씩 먹어주면 약간 느끼한게 내려가서 좋았어욛 // 생선 구이는 접근성도 좋지 않고 이거다! 하고 떠오르는 메뉴도 아니기에 노원구에 이런 가게가 있어서 다행이다.뭐 먹을지 모르겠을 때 여기로 하면 항상 평타 이상의 모습을 보여준다.넉넉한 양, 맛있는 생선 구이. // ""찐 맛집""오랜 전통과 역사를 자랑하는.. 맛집. 예전부터 많인 들렀던 곳. 깔끔하게 한식 한 끼하기 정말 괜찮은 곳. 예전보다 알고 찾아오는 손님들도 많고, 가격도 올랐지만, 그래도 좋습니다. 다만 찌개가 살짝 짠 듯한 게 아쉬움. 하지만 이만큼 고갈비 불맛에 쎄게 구워 맛있게 해주시는 집 많이 못본 것 같습니다. 김치찌개 돼지고기도 큼지막하니 맛있어요. 추천합니다!맛 : ★★★★☆양 : ★★★★☆위생 : ★★★☆☆서비스 : ★★★★☆분위기 : ★★★☆☆가격 : ★★★☆☆ // 존맛탱이에요 옛날부터 고등어 먹고싶을 때 자주 가고있습니다. // 오프라인으로 식당에 방문해서만 먹다가, 배달어플로 시켜먹어 보았는데 정말 식당에서 먹는 것 처럼 촉촉하고 맛있었습니다. 배달과, 오프라인매장 둘 다 최고의 맛 입니다."
감동식당,4.0,"3인세트 (57,500)원 주문!주말 점심 웨이팅까지 해서 먹은 노원 등갈비찜 맛집. 직원분들을 보며 왜 식당 이름이 감동식당인지 이해할 수 있었다..ㅋㅋㅋ 부담스러울 정도로 엄청난 친절함..! 3인세트는 메밀전, 나물밥이 함께 나오는데 갈비 말고도 사리가 많은데다 끝없이 밥과 야채를 리필해주셔서 넷이 먹어도 배 터질 정도의 양이었음ㅋㅋㅋ 맛은 고냥 무난한 매운갈비찜 맛? 맵찔이는 순한맛도 쫌 힘들었다 ㅎ mbti 첫글자가 E가 아니면 조금 힘들 것 같은 재밌는 식당..! ㅋㅋㅋ // -살짝매콤하게 먹고싶으면 불닭맛을 추천 (순한맛은 너무 안매워요) -다른 등갈비집이랑 비교해봤을때 곤드레밥에 나물들이 훨씬 많아요왜 감동식당인가 했더니 직원분들과 사장님의 파이팅 넘치는 열정과 감동적인 서비스에 음식을 먹기도 전에 알아차렸다 포장으로 갔지만 (포장은 5분소요) 평일인데도 불구하고 웨이팅이 네다섯팀은 꾸준히 있는편 // 노원 등갈비 맛집이에요. 셀프세차장 바로 맞은편에 위치해서 세차 후 먹으면 더 맛있어요. 집게와 젓가락으로 가볍게 뼈를 발라먹을 수 있어서 먹기도 편하고 메밀전에 싸먹는 재미도 쏠쏠하네요. 아삭한 궁채와 곤드레 나물이 들어간 황제꼬소밥은 참기름인지 고소한 향도 가득해서 밥만 먹어도 맛있을 정도에요.  순한맛으로 주문하면 신라면 정도의 매운 정도라고 했는데 적절한 표현인 것 같아요.  둘이서 2인 세트를 주문했는데 양이 많은 편이라 다 못먹을 정도였네요.  직원분들 너무 친절해서 부담스러울 정도였어요. ㅎㅎ그래도 열정 가득 보기 좋았습니다. // 2인세트 주문등갈비, 전, 시래기밥 다 맛있고 가격저렴함 // 개안음"
경성초밥,4.3,"이집의 초밥은 맛있쥬~또 사왔는데 이번에는 닭강정을 같이 사왔군요!!역시 와사비는 내스타일~새우초밥만 한팩 사다 주시는 센스~땡큐~전 열심히 하나  먹 고..두개..먹고젓가락을 내려놨습니다!!날씨가 더버져서 그런가..초밥이 미적지근해서..시원하게 먹으려고내장고 숙성을~ㅎㅎㅎ잘 먹었어영~요새 모든 음식을 집으로 사들고 와서 냉장고에 넣어둔뒤에~ 조금 시언해졌다 싶을때꺼내먹어영~^^날씨가 워낙 후덥지근 하여서 ~건강 조심 하시구영~오늘 버티면 내일은 주말~힘내세요!!아자아자 화이팅!!꺼내먹고있어영~ // 그쳥~이것이 초밥이다!!이것이 와사비다!!이집 와사비가 쫄깃~^^초새우도 신선해~저번에 갔던집 실망하고 미안해서..내내꼼지락..하고 있었는데..ㅜㅜ괜찮아 하면서..공릉동 가서 초새우초밥을 사왔어영~^^ㅎㅎ고마워맛있엉~응~이거 디게 조앙  이거 이거!!난 이 와사비가 조앙~쫄깃행~ ㅎㅎ밥도 약간 찰진느낌? 이집은 밥도 잘만들어비교해서 죄송하지만 어쩔수없는...정말 그때 그집 초밥의 밥도 좀..아니였어영 ㅜㅜ나가사끼우동은 맛있었는뎅~^^;;ㅎㅎ이제 초밥다운 초밥을 먹어본 느낌입니다~^^회는 못먹지만 초새우나 관자놀이..조갯살..이런종류초밥은 잘먹어영 ㅎㅎ맛있옹~맛있옹~ 기뷴이 조아영 ㅎㅎ // 정말 왠만하면 포장 배달 음식리뷰 안올릴려고했는데..^^;또 강제방콕강아지가 발을 다쳐섭..ㅜㅜ며칠을 또 식음전패하고 입맛 없어지고...굶다시피했는데초밥을? 음...난 초밥 먹을줄 모르는데..그래두 새우랑 관자놀이 ..계란..머머!!이런건 먹어영생선회를 먹을줄 몰라서..ㅜㅜ 그냥..머랄까안구운 날고기먹는 느낌이 들어서 못먹는거같아영 ~육회도 정말 먹음직스럽고 맛나 보이는데..막상 시켜먹으면 ..배만 골라서 먹고한줄기 육회를 씹다가..나도모르게 인상이 찌푸려지믄서울컥..나 안먹을래..미안하다 고기야...난 그저 날것을 못먹을뿐^^;;그런 저라섭~여튼그리하여 초밥먹을때도 새우만 왕창사거나횟집을 가도 비싼회는 안먹고 튀김먹고 탕먹고~^^;;올갱이 먹고 ..스끼다시 죄다 내 뱃속으로..날것이라도 쫀딕한 식감이나 양념된건 또 그리 잘먹는거 보면..아무맛 안나는 날것만 싫어하는거같아영 ~여튼 이집은 평타입니다~과하지도 그렇다고 맛이 너무 없는것도아닌뎅...제가 회맛을 잘 몰라서~문제인..근디..우동육수가~어으~~맛있어영결국 육수 두모금 먹고 끝그래도 며칠 굶고 입에 들어간게육수..국물은 넘기니~^^다행이고 잘먹고 힘냅니다~와사비 씹어 먹으니 쫀딕해...짭와사비 안쓰는집!!이상허게 와사비는 또 좋아해섭^^;;  후훗~한동안 또 배달음식이 주 리뷰가 될꺼 같습니다근대영 갠적인 생각이긴한데..초밥용기는 칸칸이 나눠진걸 쓰면 디게 좋겠다는 그런 생각을...늘 배달이나 포장 해오면 이리저리 쏠리고 양념베고ㅋㅋㅋ오롯이 하나씩 맛보는 미식가분들에겐 ~최고의배달포장용기가 되지 않을까..^^;; ㅎㅎ초밥이 비싸니까 이런 포장그릇도 업그레이드 됫으면하는 생각을 매번하네요...특히 초밥만 ~여튼 육수맛집!!저 육수에 우동이 아닌 소면을넣어서 먹으면 더 맛있었을꺼 같은간이 잘된 육수였어영~ // 공트럴파크 초입, 오마카세가 부럽지 않은 동네초밥매장은 작고 가격도 착하지만 재료 상태와 메뉴 구성 시스템까지 오마카세에 뒤쳐지지 않는다그날 그날에 따라 달라지는 모듬초밥과 특초밥의 구성 안에우니와 찐전복, 엔가와, 관자 등등 보통 초밥에서 보기 힘든 메뉴들이 포함되어 있고, 다찌쪽에 앉으면 마치 오마카세에 온 듯 순서에 따라 쥐어주신다부드럽고 고소한 자왕무시와 시원하고 깊은 맛의 우동까지,, 숨겨진 고수의 매장 같은 곳 // 21-52몇번을 벼르다가 오늘은 아주 맘막고 줄서리라고 생각하고 방문 했습니다하나씩 만들어주시는 초밥을 주문할 작정이라 가족 4명이 다찌로 주문을 했고 특초밥으로 주문했습니다바로 잡아주는 따뜻한밥에 올려진 고퀼의 재료가 너무 맛있습니다저렴하게 즐기는 오마카세의 행복입니다아내와 아이들은 평소 먹던 양보다 많이 먹었는데 하나씩 다음걸 울려주니까 쫓기듯 먹게되는데 맛있어서 그걸 몰랐다고 하네요11번째인가 나온 우니가 대박입니다바다의 버터인듯 부드러운 식감과 맛이 거의 백미였습니다아주 잘먹고 만족스러운 한끼였습니다서빙보시는 두분과 쉐프분들도 너무 친절하십니다.방문추천 100%친절도 상청결 중주차불가"
노원우동짜장,4.0,"여기는 옛추억과 함께 먹는 곳 여기 이전에는 에이비씨 마트 옆에 포장마차였어요 추운 날씨에 입김 호호 내면서 패딩 입고 손 넣고 기다리다우동 나오면 먹었었는데 그때만큼의 정취나 고런 맛은 떨어져요 그렇지만 그래도 기계 우동 수유리 우동 가봐도 여기서 먹던 맛을 못잊겠어서 들렸어요 크크크크 뭐 특별한것도 없는데 막상 그래요~ 여전히 면은 쫀득하면서 보드랍고 국물도 과하지 않고 전 매콤한게 좋아서 언제나 고추가루 추가해요 그리고 단무지에 면 싸서 먹기 같이간 일행이 짜장을 시켜서 한젓가락 뺏어먹으면 완벽해요 크크크곱배기도 가능한데 1천원 추가구요 원래 금액 5천에서 6천 되는거에요~ 매장은 좀 좁고 새벽에 가면 취객들도 있어요 // 새벽까지 하니까 영업시간도 널널하고 멀지 않으니까 한번 가봐야지 하고 큰기대 없이 갔는데 정말 맛있던 짜장면. 우동이랑 짜장을 같이팔길래 짜장은 그냥 구색정도고 삼분짜장정도 아닐까 했는데 약간 명동 개화의 유니짜장 느낌이라고 해야하나. 간고기가 살짝씩 섞여있고 물기많은 스타일이다. 직접 만드는 찰진 면이랑 잘 어울려서 촥촥 감기는 식감이 좋았다. 고추가루랑도 잘어울리고 신기하게 다시마 식초도 준비되어있음. 5천원에 이정도 맛이면 아주 좋다. // 요즘 노원에서 가장 손님이 많은 식당이자. 나도 가장 많이 다녀간 곳. 포차 우동, 짜장 특징이 혀가 즈릴만큼 짭짤한 맛이 특징인데. 여긴 굉장히 담백한 우동, 짜장이다. 그렇다고 너무 삼삼하지도 않고 딱 좋은 간. 짜장도 맛있지만 단연 우동이 존존맛. 여길 알게 된 후. 동네 친구집이나 우리집에서 술 한잔 할 때. 따릉이 타고 직접 우동을 포장해와 맨날 먹었다. ㄹㅇ 노원 최고의 국물.포장 사진은 못 찍었지만. 단 돈 오천원에 면과 국물을 분리해 포장해 주는 세심함까지. 사소한 걸수 있지만 요즘 면요리 배달 시키면 대부분 그런 경우가 없기에 큰 인상을 받았다. 면도 신기하게 잘 안퍼져서. 이 맛을 알면 따릉이 타고 출발할 수 밖에 없다. 그저 오랫동안 그 자리를 지켜줬음 좋겠다. // 저한테는 맛보다는 감성으로 인해 정말 좋았던 곳.요새는 가게를 찾아가기 전에 검색하고 가는 경우가 많은데 이 날은 피곤하기도 하고 귀찮아서 그냥 무작정 돌아다녔어요. 그러다 골목 어귀에서 새빨갛고 조그만 가게가 눈에 띄여서 들어갔어요.밖에서도 얼추 짐작은 했지만 가게가 정말 작아요. 좁은 공간에 몇 개 안되는 테이블이 다닥다닥 붙어있어요. 매뉴도 짜장과 우동 두 개 뿐. 우동곱빼기(5,000원)을 주문했어요.얼마 지나지 않아 김가루가 듬뿍 올려진 우동이 나왔어요. 테이블마다 올려진 고춧가루를 솔솔 뿌리고 먹으니 옛날에 중학생 때 먹었던 우동이 생각나더라구요. 수학학원에서 밤에 수업이 끝나면 선생님이 종종 포장마차에서 우동을 사주셨는데 딱 그 느낌이었어요. 그때는 고춧가루가 들어간 우동이 별로였는데 어느 순간부터 그 맛이 그리워지더라구요. 맛 자체는 특별할 게 없으나 그때의 감성이 생각나서 맛있게 먹었어요. 아, 그리고 양이 정말 어마무시하게 많았어요. 도대체 이 가격에 이 양을 어떻게 내시는지 궁금할 정도였어요.다 먹고 몇 가지 여쭤봤는데 먼저 면은 직접 만드신다고 해요. 그래서 그런지 굵기가 다른 면이 조금씩 섞여 있었어요. 그리고 영업은 오후7시부터 새벽 4시까지 하신다고 해요. 술은 안 팔구요!보니까 사장님이랑 손님이랑 종종 얘기도 하면서 그런 좀 친근한? 가게인 거 같아요. 아직 한 번 밖에 가보질 않았지만 왜인지 정감이 갔어요. 세월이 지나도 계속 장사하셨으면 좋겠어요.."
관동식당,4.0,"후토마끼에 오이가 아닌 아보카도가 들어갔으니오싫모 회원들은 겁먹지 말것사시미는 그저 그랬다 숙성이 덜 된 느낌 // 신라호텔 출신 쉐프가 만드는 괜찮은 메뉴들노원역 뒷골목에 숨겨진, 예쁘고 맛나고 고급스러운 갓포요리사시미와 구이&조림, 튀김과 나베,식사와 사이드로 구성되었는데참치피자나 스키야키, 나고야식장어덮밥, 모츠나베와 후토마키 등 주위에서 쉽게 보기힘든 메뉴들을 운영한다이중에 트러플광어카르파치오, 모츠나베, 후토마키하이볼코크 주문고소한 참깨소스에 트러플향 가득 배인 광어를 야채에 싸 먹고실하게 들어간 대창의 양과는 다르게, 칼칼하면서 담백깔끔하게 맛을 낸 모츠나베가 엄청 맛나다마지막 후토마키도 좋은 재료를 아끼지 않고 밸런스를 잘 잡아서 내공이 느껴지는 맛 ㅎ왜 항상 줄이 많은지 알 수 있는 곳 // 노원에 몇 없는 모던한 느낌의 일식당이다. 노원역 먹자골목에 위치해 있는데, 가는 길에 담배피는 사람 너무 많아서 좀 텐션이 많이 다운됐음.. 이쪽 부근은 너무 술집만 많고 좀 피곤한 동네인거 같긴 하다.(이 지역에 살고 있어서 하는 말입니다ㅠㅠ) 아무튼 그런 골목에 위치해 있는 관동식당에 방문하였다.메뉴판 사진을 따로 찍지는 못했는데, 그날그날마나 메뉴가 바뀌는 것 같았다. 1월 1일에 방문했는데 그래서 그런지 메뉴가 평소보다 적은 것 같았다. 메뉴 이름이 정확히 기억은 안 나는데, 매콤토마토해산물스튜? 랑 사시미 2인을 시켰다. 음 일단 가게가 좀 많이 협소하다. 2인이 방문해서 2인 테이블로 안내를 받았는데, 플레이트 2개를 올리기에는 좀 작은 테이블이였다. 스튜가 먼저 나왔는데, 토마토 스튜 느낌인데 해산물을 엄청 때려넣은 느낌이다! 국물을 떠 먹었을때 조개 맛이 진하게 느껴져서 좋았다. 건더기를 다 건져 먹은 다음에 면 추가를 할 수 있는데(+3000원), 그러면 새로운 접시에 파스타를 만들어서 가져다 주신다. 근데 이게 또 굉장히 맛있다. 간이 쎄서 소주 안주로도 좋다. 소주는 한라산만 판다. (6000원)사시미 2인은 3만원 후반대였던 것 같은데 구성은 좋았지만 생선의 퀄리티가 좀 아쉬웠다. 갈치, 삼치, 고등어 등 노원의 이자카야에서는 보기 힘든, 다양한 구성이긴 했지만 각각이 조금씩 아쉬웠다. 갈치, 삼치는 수분이 날라간 듯 푸석했고.. 종류를 다양하게 하려다보니 각각의 퀄리티를 조금 신경 못 쓴 느낌.결론적으로는 적당히 괜찮았다. 자리만 쾌적하면 좋을텐데, 그게 좀 많이 아쉽다. 그래서 재방문을 할지는 잘 모르겠다. 부모님 모시고 가기에는 적합하지 않은 듯. // 노원에서 먹어본 회 중 최고..!이곳은 신라호텔 출신 셰프님이 운영하시는 비교적 최근에 오픈한 일식집입니다. 숙성회를 전문으로 하는 곳이라고 생각하면 될 것 같은데 정말 신선하고 맛있었습니다ㅠ확실한건 평범한 스타일의 집은 아닙니다! 제철 사시미는 오마카세 가서야 먹을 수 있을 것 같은 보통은 먹기 어려운 재료들로 구성되어있습니다. 한치랑 삼치가 정말 맛있었던 기억이 나네요,,가격대가 조금 있기 때문에 많은 메뉴를 먹어보진 못했지만 도장깨기 해보고 싶네요ㅠ // 진짜 맛있게 먹었는데 사진 다 구리게 나와서 속상쓰,, 가격대도 합리적이고 생맥주가 진짜 맛있어요!! 금태 솥밥도 참치회 피자도 너무 맛있게 먹었습니다ㅎㅎ 찹쌀 탕수육 같은건 무남하니 굳이 안시키셔도 돼요! 이때는 예약이 안됐는데 지금은 된다는 것 같네요."
버거투버거,4.0,"학교 앞에서 찾은 훌륭한 수제버거고등학교 앞에 있는 작은 매장철판에 번, 종이에 싼 버거..어릴적 분식집에서 이모님이 파시던 느낌인데, 메뉴 구성과 맛은 전혀 평볌하지 않다번과 패티는 그럴수 있는데 볶은 양파를 쓰시고,뮌스터, 브로볼론, 고르곤졸라, 아메리칸, 모짜렐라까지 다양한 치즈와 소스에 따라 메뉴가 엄청 다양하다가장 고가인 애니멀파파버거(7,500원) 주문패티2장이 주는 풍부한 육즙, 토마토와 양상추의 채즙, 치즈의 리치함까지 어지간한 수제버거와 견주어도 밀리지 않는 맛이다사이드메뉴가 없어서 버거를 두개 먹을까 고민을 했는데,생각보다 든든하게 배가 찬다 ㅎ일부러 찾아오지 않고서는 오기 힘든 곳인데,왜 사람이 가득한지 짐작이 되는 ㅎ 응원하고 싶은 곳 // 맛과 가성비 뛰어난  최고의 수제버거 맛집.이곳 다닌지 10년이 넘었네요. // 이제야 가 본 버거투버거. 오늘의 목적지로 정해 부러 찾아간 곳. 대진고 바로 앞에 있었음. 많은 고민끝에 리치버거에 해쉬브라운 추가. 가게에서 먹어야 한 단 리뷰를 많이 봐서 매장에서 식사. 패티가 수제버거 치고도 되게 고기고기스러워서 맛있었고 볶은양파가 치트기였음. 다른 친구가 시킨 디럭스버거는 솔까 맥땡 디럭스보다 나았음. 비쥬얼이 찢었으나 넘 배고파 먹느라 찍지 못 함. ㅜㅜ 아쉬운 점은 사이드가 없어서 대식좌는 배가 금방 고팠다. 매장에서 버거 2개 먹기엔 또 조금 해비해서 애매했음. 사이드도 몇 개만 만들어주시면 더할 나위없이 좋을 듯~ 총평: 고급 수제버거와 프랜차이즈의 중간 어디쯤. 그래도 맛있다!! // 오랜만에 가서 포장을 해봤다. 포장은 처음.1시 좀 안된 시간에 들렸는데 점심이라 사람이 많을 줄 알았는데 한산했다.뮌스터 클래식버거(5000), 더블버거(4500), 해쉬브라운 버거(4500)를 주문. 바로 구워서 나오니까 시간좀 걸리려나 했는데 5분도 안걸렸던 것 같음. 집까지 30분 좀 안되게 걸렸는데 예전 리뷰에 썼던 내용이 딱 맞다. 소스가 많아서 포장보단 먹고가는게 나을것 같다고 썼는데 포장하니 식진 않았는데 세메뉴 다 질척거림.  그래도 가성비 좋고 맛있었고 누가 뮌스터보다 해쉬가 더 맛있다길래 처음 주문해봤는데 바삭함이 살아있어서 세메뉴중 제일 좋았음. // 가격 대비 퀄리티는 따라올 집이 없을 듯"
생선까시,4.0,"공릉동 #생선까시생선 눈이 날 쳐다보네..미안하게뒤집어!!!잘 먹어보겠업♡새삼 동태탕 국물이 이리 끝내줄 줄이야행복하도다~겁나 맛있어 ~왠열 여기 동태탕 끝내주네~국물 리필 하고싶다 순두부시킬까 하다 동태탕 시킨건데초이스 오졌다리~ㅎ근데 삼치가 모닝?ㅜㅜ난 고등어가 좋던대 동태탕 시켜서 생선은 양보했더니생각했던 촉촉이가 아니래..ㅋㅋ그려~모니모니 해두 짭짤하고탱탱한~~ 밥에 어울리는 고등어 구이가짱이여담엔 고등어 묵장^^글고 이 집이 좋은 이유!!생선굽는 아저씨가 생선이 다 구어 질때쯤종을 한번 땡~울리심 그러면 서빙 상차림이 시작^^그후에 생선과  탕이 차례로 나온다손님을 베려한 시스템 쪼아♡글구 이집은 일반물이 아닌구수한 차를 주니 좋군하깔끔하고 조아 이쪽 골목길 쪽이 싹 칼국수맛집들인데~이 골목쪽 번창했음 좋겠당^^아참 이집도 커피서비쑤~쪼아 ㅎㅎ#위드인기맛집#""찐""맛집 // 공릉동 동네맛집 무난하게 다 맛있다ㅋㅋ파절임도 맛있고 고등어 속살도 알차다. // 깔끔한 음식 // 20-112-리뷰원정 66독특한 가게 이름으로  시선을 강탈하는 누가봐도 생선구이 전문점생선구이류는 적당히 잘 구워져서 나옵니다 촉촉한 속살이 신선하다라고 외치고 있습니다다양한 밥 종류가 지루하지 않게 포진되어 있으며 가격에 적당한 맛과 수준을 유지합니다그러나 개성강한 가게 이름에 너무 개성없는 메인 입니다방문추천 90%서비스 25%청결 80%주차불가 // 그냥 생선구이 밥집 찌개는 특별한 것 없는 조미료맛"
당혹,4.3,"엇.. 맛있다!레몬의 모든 변형에 환장하는 사람으로서 이 레몬 마들렌은 정말 맛있었어요! 또 들려서 다른 맛도 먹어보고 싶음.푸딩은 별로 안 좋아하지만 초코 푸딩하고 바닐라 푸딩도 사봤는데 부드럽게 말랑? 해서 제 취향은 아니였어요! 그래도 맛있음담에 또 들리겠습니다.. // * 맛집 인스타 : @tastekim_v노원에서 푸딩맛집으로 유명한 가게다.푸딩과 마들렌 등 구움과자, 그리고 딱 음료만을 판매하는 뚝심있는 곳.앉아서 먹을 자리는 없어 테이크아웃만 가능한 것이 아쉽다. 바닐라 푸딩과 제일 인기많다는 쇼콜라 마들렌을 포장해 나왔다.[메뉴]1️⃣ 샛노란 빛깔이 먹음직스러운 바닐라 푸딩부터 열어본다. 바닐라빈이 콕콕 박혀있고, 하단에 흑설탕이 깔려 있는 것이 눈에 띈다.전체적으로 무겁지 않고 은은해서 좋다. 바닐라맛과 향도 부담스럽지 않으며, 탱글한 푸딩의 단맛도 산뜻하게 다가온다.끝에 살짝 퍼지는 계란과 우유스런 고소함까지 훌륭하다. 계란 풍미를 또렷하게 살리면서도 비린내로 느껴질 부분은 확실하게 쳐냈다는 게 인상깊다.하단의 흑설탕은 딱딱하게 굳어 있어서 흡사 달고나같다. 섞기 전에는 푸딩맛을 해치지 않는다는 측면에서 맘에 든다. 퀄리티 확실한 푸딩이다.2️⃣ 쇼콜라 마들렌은 겉면의 카카오 가루 때문에 '먹기 힘들겠다'는 생각을 했는데, 생각보다 가루가 흩날리지 않아 다행이었다.씁쓸한 카카오 향에 안쪽엔 초콜릿 가나슈가 들어가 있다. 덕분에 마들렌이 퍽퍽하지 않으며 진하지만 과하지 않게 빵을 더욱 돋보이게 한다.가나슈 없는 부분 역시, 설탕코팅 덕에 바삭하면서도 마들렌과 초코 맛이 위화감 없이 융화된다. 전반적으로 퐁신한 느낌이다.3️⃣ 둘 다 참 잘만드는데 앉아서 먹을 자리좀 있었으면 좋긴 하겠다. // 마들렌은 왠지 진해보여서 담백해보이는 휘낭시에로 플레인, 아몬드, 홍차 휘낭시에와 바닐라 푸딩을 포장했다.바닐라 푸딩은 먹는 방법을 친절히 설명해주시면서 보냉팩에 조심히 담아주신다.휘낭시에, 마들렌 모두 이곳만의 메뉴들이 있다.누네띠네 휘낭시에도 있었는데 다음엔 그것도 맛보고 싶다.겉은 단단히 바삭하면서 속은 파운드리한 부드러움을 가지고 있는 휘낭시에는 내 입맛에 딱이었다.바닐라푸딩도 엄청 달지 않고 깔끔하다가 중간부터 밑에 캬라멜시럽과 섞어 먹으면서 아주 달콤한 맛을 느낄 수 있다.조금 차갑게 해서 먹으니 더욱 내 스타일이었다.이제 디저트 선물할 일이 있을 때 너무 멀리 가지 않고 여기서 사서 가야겠다^_^다음에는 다른 메뉴의 구움과자와 밀크티도 맛 보고 싶다.매장내부에 먹을 수 있는 테이블은 없어서 테이크아웃 전문입니다! // 제가 생각했던 일본식의 부드러운 푸딩은 아니었어요약간 쫀득한 느낌?나쁘진 않았는데 개인적으로는 사르르 녹는 푸딩을 좋아해서 제 취향은 아니었네요밑에 시럽도 좀 양이 많고 너무 달았어요 // 가끔 지나갈 일 생기면 들르는 맛있는 구움과자 집!가로수길 에뚜왈의 휘낭시에가 저에겐 No.1이지만, 그곳 못지 않게 휘낭시에와 마들렌이 훌륭한 곳이에요!전에 푸딩도 먹어봤는데 그건 또 먹을 정도는 아니었구요~지나가는 일 있을때 마다 사오게 되는 그런 곳입니다!사진은 아몬드 휘낭시에고 레몬 마들렌, 누네띠네 휘낭시에도 맛있었어요!"
